id,input,output,text
40,"NLPR has not yet been extensively studied in patients with cholecystitis. NLPR has been investigated as a routine CBC inflammation index in other diseases, showing potential as a risk factor or marker of disease severity.","[{'entity1': 'NLPR', 'relationship': 'studied', 'entity2': 'patients with cholecystitis'}, {'entity1': 'NLPR', 'relationship': 'inflammation index', 'entity2': 'diseases'}, {'entity1': 'NLPR', 'relationship': 'risk factor', 'entity2': 'disease severity'}]","<s>[INST] Extract the entities and relationships from the following text: </s>[SYS] User prompt [/INST] NLPR has not yet been extensively studied in patients with cholecystitis. NLPR has been investigated as a routine CBC inflammation index in other diseases, showing potential as a risk factor or marker of disease severity. </s> Model answer <s>[{'entity1': 'NLPR', 'relationship': 'studied', 'entity2': 'patients with cholecystitis'}, {'entity1': 'NLPR', 'relationship': 'inflammation index', 'entity2': 'diseases'}, {'entity1': 'NLPR', 'relationship': 'risk factor', 'entity2': 'disease severity'}]</s>"
41,"Our research shows that indicators such as NLR, PLR, SII, and NPLR have the potential to differentiate between ACC and CCC patients. NLR demonstrates the highest sensitivity and accuracy in this differentiation.","[{'entity1': 'NLR', 'relationship': 'differentiate', 'entity2': 'ACC and CCC patients'}, {'entity1': 'NLR', 'relationship': 'sensitivity', 'entity2': 'differentiation'}]","<s>[INST] Extract the entities and relationships from the following text: </s>[SYS] User prompt [/INST] Our research shows that indicators such as NLR, PLR, SII, and NPLR have the potential to differentiate between ACC and CCC patients. NLR demonstrates the highest sensitivity and accuracy in this differentiation. </s> Model answer <s>[{'entity1': 'NLR', 'relationship': 'differentiate', 'entity2': 'ACC and CCC patients'}, {'entity1': 'NLR', 'relationship': 'sensitivity', 'entity2': 'differentiation'}]</s>"
42,"NLR, SII, and NPLR, from specific cut-off values, but not PLR, can predict the severity of ACC in patients. Notably, NPLR exhibits the highest specificity among the studied indicators.","[{'entity1': 'NLR', 'relationship': 'predict', 'entity2': 'severity of ACC'}, {'entity1': 'SII', 'relationship': 'predict', 'entity2': 'severity of ACC'}, {'entity1': 'NPLR', 'relationship': 'predict', 'entity2': 'severity of ACC'}, {'entity1': 'NPLR', 'relationship': 'exhibits', 'entity2': 'highest specificity'}]","<s>[INST] Extract the entities and relationships from the following text: </s>[SYS] User prompt [/INST] NLR, SII, and NPLR, from specific cut-off values, but not PLR, can predict the severity of ACC in patients. Notably, NPLR exhibits the highest specificity among the studied indicators. </s> Model answer <s>[{'entity1': 'NLR', 'relationship': 'predict', 'entity2': 'severity of ACC'}, {'entity1': 'SII', 'relationship': 'predict', 'entity2': 'severity of ACC'}, {'entity1': 'NPLR', 'relationship': 'predict', 'entity2': 'severity of ACC'}, {'entity1': 'NPLR', 'relationship': 'exhibits', 'entity2': 'highest specificity'}]</s>"
43,"NLR as the only factor independently and precisely associated with the severity of ACC. These findings highlight the potential of CBC as a readily available, and inexpensive test for predicting the severity of cholecystitis early on.","[{'entity1': 'NLR', 'relationship': 'associated', 'entity2': 'severity of ACC'}, {'entity1': 'CBC', 'relationship': 'predicting', 'entity2': 'severity of cholecystitis'}]","<s>[INST] Extract the entities and relationships from the following text: </s>[SYS] User prompt [/INST] NLR as the only factor independently and precisely associated with the severity of ACC. These findings highlight the potential of CBC as a readily available, and inexpensive test for predicting the severity of cholecystitis early on. </s> Model answer <s>[{'entity1': 'NLR', 'relationship': 'associated', 'entity2': 'severity of ACC'}, {'entity1': 'CBC', 'relationship': 'predicting', 'entity2': 'severity of cholecystitis'}]</s>"
44,"The Significance of Preoperative Neutrophil-to-Lymphocyte Ratio (NLR), Platelet-to-Lymphocyte Ratio (PLR), and Systemic Inflammatory Index (SII) in predicting severity and adverse outcomes in acute calculous cholecystitis.","[{'entity1': 'Neutrophil-to-Lymphocyte Ratio', 'relationship': 'predicting', 'entity2': 'severity'}, {'entity1': 'Platelet-to-Lymphocyte Ratio', 'relationship': 'predicting', 'entity2': 'adverse outcomes'}, {'entity1': 'Systemic Inflammatory Index', 'relationship': 'predicting', 'entity2': 'severity'}]","<s>[INST] Extract the entities and relationships from the following text: </s>[SYS] User prompt [/INST] The Significance of Preoperative Neutrophil-to-Lymphocyte Ratio (NLR), Platelet-to-Lymphocyte Ratio (PLR), and Systemic Inflammatory Index (SII) in predicting severity and adverse outcomes in acute calculous cholecystitis. </s> Model answer <s>[{'entity1': 'Neutrophil-to-Lymphocyte Ratio', 'relationship': 'predicting', 'entity2': 'severity'}, {'entity1': 'Platelet-to-Lymphocyte Ratio', 'relationship': 'predicting', 'entity2': 'adverse outcomes'}, {'entity1': 'Systemic Inflammatory Index', 'relationship': 'predicting', 'entity2': 'severity'}]</s>"
45,Prognostic value of preoperative neutrophil-to-lymphocyte ratio for prediction of severe cholecystitis.,"[{'entity1': 'Neutrophil-to-Lymphocyte Ratio', 'relationship': 'prediction', 'entity2': 'severe cholecystitis'}]","<s>[INST] Extract the entities and relationships from the following text: </s>[SYS] User prompt [/INST] Prognostic value of preoperative neutrophil-to-lymphocyte ratio for prediction of severe cholecystitis. </s> Model answer <s>[{'entity1': 'Neutrophil-to-Lymphocyte Ratio', 'relationship': 'prediction', 'entity2': 'severe cholecystitis'}]</s>"
46,Inflammation-based prognostic scores predict disease severity in patients with acute cholecystitis.,"[{'entity1': 'Inflammation-based prognostic scores', 'relationship': 'predict', 'entity2': 'disease severity'}, {'entity1': 'Inflammation-based prognostic scores', 'relationship': 'predict', 'entity2': 'patients'}]","<s>[INST] Extract the entities and relationships from the following text: </s>[SYS] User prompt [/INST] Inflammation-based prognostic scores predict disease severity in patients with acute cholecystitis. </s> Model answer <s>[{'entity1': 'Inflammation-based prognostic scores', 'relationship': 'predict', 'entity2': 'disease severity'}, {'entity1': 'Inflammation-based prognostic scores', 'relationship': 'predict', 'entity2': 'patients'}]</s>"
47,"Platelets play a crucial role in inflammation and atherogenesis, contributing to the progression of diseases.","[{'entity1': 'Platelets', 'relationship': 'role', 'entity2': 'inflammation'}, {'entity1': 'Platelets', 'relationship': 'contribution', 'entity2': 'diseases'}]","<s>[INST] Extract the entities and relationships from the following text: </s>[SYS] User prompt [/INST] Platelets play a crucial role in inflammation and atherogenesis, contributing to the progression of diseases. </s> Model answer <s>[{'entity1': 'Platelets', 'relationship': 'role', 'entity2': 'inflammation'}, {'entity1': 'Platelets', 'relationship': 'contribution', 'entity2': 'diseases'}]</s>"
48,Neutrophil-to-lymphocyte ratio is considered an emerging marker of the relationships between the immune system and diseases.,"[{'entity1': 'Neutrophil-to-lymphocyte ratio', 'relationship': 'marker', 'entity2': 'relationships'}, {'entity1': 'Neutrophil-to-lymphocyte ratio', 'relationship': 'immune system', 'entity2': 'diseases'}]","<s>[INST] Extract the entities and relationships from the following text: </s>[SYS] User prompt [/INST] Neutrophil-to-lymphocyte ratio is considered an emerging marker of the relationships between the immune system and diseases. </s> Model answer <s>[{'entity1': 'Neutrophil-to-lymphocyte ratio', 'relationship': 'marker', 'entity2': 'relationships'}, {'entity1': 'Neutrophil-to-lymphocyte ratio', 'relationship': 'immune system', 'entity2': 'diseases'}]</s>"
49,C-reactive protein is being compared to the neutrophil/lymphocyte ratio and platelet/lymphocyte ratio in terms of being a superior marker of inflammation in acute cholecystitis.,"[{'entity1': 'C-reactive protein', 'relationship': 'comparison', 'entity2': 'neutrophil/lymphocyte ratio'}, {'entity1': 'C-reactive protein', 'relationship': 'comparison', 'entity2': 'platelet/lymphocyte ratio'}, {'entity1': 'C-reactive protein', 'relationship': 'marker', 'entity2': 'inflammation'}, {'entity1': 'C-reactive protein', 'relationship': 'inflammation', 'entity2': 'acute cholecystitis'}]","<s>[INST] Extract the entities and relationships from the following text: </s>[SYS] User prompt [/INST] C-reactive protein is being compared to the neutrophil/lymphocyte ratio and platelet/lymphocyte ratio in terms of being a superior marker of inflammation in acute cholecystitis. </s> Model answer <s>[{'entity1': 'C-reactive protein', 'relationship': 'comparison', 'entity2': 'neutrophil/lymphocyte ratio'}, {'entity1': 'C-reactive protein', 'relationship': 'comparison', 'entity2': 'platelet/lymphocyte ratio'}, {'entity1': 'C-reactive protein', 'relationship': 'marker', 'entity2': 'inflammation'}, {'entity1': 'C-reactive protein', 'relationship': 'inflammation', 'entity2': 'acute cholecystitis'}]</s>"
50,The utility of the preoperative neutrophil-to-lymphocyte ratio in predicting severe cholecystitis has been studied in a retrospective cohort.,"[{'entity1': 'Neutrophil-to-lymphocyte ratio', 'relationship': 'predicting', 'entity2': 'severe cholecystitis'}, {'entity1': 'Neutrophil-to-lymphocyte ratio', 'relationship': 'utility', 'entity2': 'preoperative'}, {'entity1': 'Neutrophil-to-lymphocyte ratio', 'relationship': 'study', 'entity2': 'retrospective cohort'}]","<s>[INST] Extract the entities and relationships from the following text: </s>[SYS] User prompt [/INST] The utility of the preoperative neutrophil-to-lymphocyte ratio in predicting severe cholecystitis has been studied in a retrospective cohort. </s> Model answer <s>[{'entity1': 'Neutrophil-to-lymphocyte ratio', 'relationship': 'predicting', 'entity2': 'severe cholecystitis'}, {'entity1': 'Neutrophil-to-lymphocyte ratio', 'relationship': 'utility', 'entity2': 'preoperative'}, {'entity1': 'Neutrophil-to-lymphocyte ratio', 'relationship': 'study', 'entity2': 'retrospective cohort'}]</s>"
51,Prognostic value of the systemic immune-inflammation index (SII) after neoadjuvant therapy for patients with resected pancreatic cancer.,"[{'entity1': 'Systemic immune-inflammation index', 'relationship': 'prognostic value', 'entity2': 'neoadjuvant therapy'}, {'entity1': 'Systemic immune-inflammation index', 'relationship': 'prognostic value', 'entity2': 'pancreatic cancer'}]","<s>[INST] Extract the entities and relationships from the following text: </s>[SYS] User prompt [/INST] Prognostic value of the systemic immune-inflammation index (SII) after neoadjuvant therapy for patients with resected pancreatic cancer. </s> Model answer <s>[{'entity1': 'Systemic immune-inflammation index', 'relationship': 'prognostic value', 'entity2': 'neoadjuvant therapy'}, {'entity1': 'Systemic immune-inflammation index', 'relationship': 'prognostic value', 'entity2': 'pancreatic cancer'}]</s>"
52,"Role of leukocytes and systemic inflammation indexes (NLR, PLR, MLP, dNLR, NLPR, AISI, SIR-I, and SII) on admission predicts in-hospital mortality in non-elderly and elderly COVID-19 patients.","[{'entity1': 'Leukocytes', 'relationship': 'role', 'entity2': 'in-hospital mortality'}, {'entity1': 'Systemic inflammation indexes', 'relationship': 'predicts', 'entity2': 'in-hospital mortality'}, {'entity1': 'COVID-19 patients', 'relationship': 'age', 'entity2': 'non-elderly'}, {'entity1': 'COVID-19 patients', 'relationship': 'age', 'entity2': 'elderly'}]","<s>[INST] Extract the entities and relationships from the following text: </s>[SYS] User prompt [/INST] Role of leukocytes and systemic inflammation indexes (NLR, PLR, MLP, dNLR, NLPR, AISI, SIR-I, and SII) on admission predicts in-hospital mortality in non-elderly and elderly COVID-19 patients. </s> Model answer <s>[{'entity1': 'Leukocytes', 'relationship': 'role', 'entity2': 'in-hospital mortality'}, {'entity1': 'Systemic inflammation indexes', 'relationship': 'predicts', 'entity2': 'in-hospital mortality'}, {'entity1': 'COVID-19 patients', 'relationship': 'age', 'entity2': 'non-elderly'}, {'entity1': 'COVID-19 patients', 'relationship': 'age', 'entity2': 'elderly'}]</s>"
53,"The Journal of Inflammation Research is an international, peer-reviewed open-access journal that welcomes laboratory and clinical findings on the molecular basis, cell biology and pharmacology of inflammation including original research, reviews, symposium reports, hypothesis formation and commentaries on acute/chronic inflammation; mediators of inflammation; cellular processes; molecular mechanisms; pharmacology and novel anti-inflammatory drugs; clinical conditions involving inflammation.","[{'entity1': 'Journal of Inflammation Research', 'relationship': 'focuses on', 'entity2': 'inflammation'}, {'entity1': 'Journal of Inflammation Research', 'relationship': 'welcomes', 'entity2': 'laboratory findings'}, {'entity1': 'Journal of Inflamm Research', 'relationship': 'reviews', 'entity2': 'molecular mechanisms'}, {'entity1': 'Journal of Inflamm Research', 'relationship': 'discusses', 'entity2': 'pharmacology'}, {'entity1': 'Journal of Inflamm Research', 'relationship': 'includes', 'entity2': 'clinical conditions'}]","<s>[INST] Extract the entities and relationships from the following text: </s>[SYS] User prompt [/INST] The Journal of Inflammation Research is an international, peer-reviewed open-access journal that welcomes laboratory and clinical findings on the molecular basis, cell biology and pharmacology of inflammation including original research, reviews, symposium reports, hypothesis formation and commentaries on acute/chronic inflammation; mediators of inflammation; cellular processes; molecular mechanisms; pharmacology and novel anti-inflammatory drugs; clinical conditions involving inflammation. </s> Model answer <s>[{'entity1': 'Journal of Inflammation Research', 'relationship': 'focuses on', 'entity2': 'inflammation'}, {'entity1': 'Journal of Inflammation Research', 'relationship': 'welcomes', 'entity2': 'laboratory findings'}, {'entity1': 'Journal of Inflamm Research', 'relationship': 'reviews', 'entity2': 'molecular mechanisms'}, {'entity1': 'Journal of Inflamm Research', 'relationship': 'discusses', 'entity2': 'pharmacology'}, {'entity1': 'Journal of Inflamm Research', 'relationship': 'includes', 'entity2': 'clinical conditions'}]</s>"
54,The manuscript management system is completely online and includes a very quick and fair peer-review system.,"[{'entity1': 'manuscript management system', 'relationship': 'online', 'entity2': 'quick peer-review system'}]","<s>[INST] Extract the entities and relationships from the following text: </s>[SYS] User prompt [/INST] The manuscript management system is completely online and includes a very quick and fair peer-review system. </s> Model answer <s>[{'entity1': 'manuscript management system', 'relationship': 'online', 'entity2': 'quick peer-review system'}]</s>"
0,"Chronic inflammation is a pernicious underlying status, well-known for its contribution to the progressive development of various diseases. Micro-immunotherapy (MI) employs low doses (LD) and ultra-low doses (ULD) of immune regulators in their formulations.","[{'entity1': 'Chronic inflammation', 'relationship': 'contribution', 'entity2': 'progressive development'}, {'entity1': 'Micro-immunotherapy', 'relationship': 'employs', 'entity2': 'immune regulators'}, {'entity1': 'Micro-immunotherapy', 'relationship': 'strategy', 'entity2': 'therapeutic'}]","<s>[INST] Extract the entities and relationships from the following text: </s>[SYS] User prompt [/INST] Chronic inflammation is a pernicious underlying status, well-known for its contribution to the progressive development of various diseases. Micro-immunotherapy (MI) employs low doses (LD) and ultra-low doses (ULD) of immune regulators in their formulations. </s> Model answer <s>[{'entity1': 'Chronic inflammation', 'relationship': 'contribution', 'entity2': 'progressive development'}, {'entity1': 'Micro-immunotherapy', 'relationship': 'employs', 'entity2': 'immune regulators'}, {'entity1': 'Micro-immunotherapy', 'relationship': 'strategy', 'entity2': 'therapeutic'}]</s>"
1,"Two unitary MIM consisting of ultra-low doses (ULD) of IL-1β and TNF-α (u-MIM-1 and u-MIM-2, respectively), and four complex MIM (c-MIM-1, −2, −3 and −4) characterized by the presence of ULD of IL-1β and TNF-α amongst other factors were assessed for their anti-inflammatory effects.","[{'entity1': 'u-MIM-1', 'relationship': 'effects', 'entity2': 'inflamed colon carcinoma cells'}, {'entity1': 'c-MIM-1', 'relationship': 'capability', 'entity2': 'restore altered transepithelial electrical resistance'}, {'entity1': 'c-MIM-1', 'relationship': 'increased', 'entity2': 'expression of claudin-1'}]","<s>[INST] Extract the entities and relationships from the following text: </s>[SYS] User prompt [/INST] Two unitary MIM consisting of ultra-low doses (ULD) of IL-1β and TNF-α (u-MIM-1 and u-MIM-2, respectively), and four complex MIM (c-MIM-1, −2, −3 and −4) characterized by the presence of ULD of IL-1β and TNF-α amongst other factors were assessed for their anti-inflammatory effects. </s> Model answer <s>[{'entity1': 'u-MIM-1', 'relationship': 'effects', 'entity2': 'inflamed colon carcinoma cells'}, {'entity1': 'c-MIM-1', 'relationship': 'capability', 'entity2': 'restore altered transepithelial electrical resistance'}, {'entity1': 'c-MIM-1', 'relationship': 'increased', 'entity2': 'expression of claudin-1'}]</s>"
2,"In vitro investigations on c-MIM-2 and c-MIM-3 revealed their immune-modulatory effects in LPS-inflamed human monocytes, macrophages, and granulocytes, on the secretion of cytokines such as TNF-α, PGE2, and IL-6.","[{'entity1': 'c-MIM-2', 'relationship': 'effects', 'entity2': 'LPS-inflamed human monocytes'}, {'entity1': 'c-MIM-3', 'relationship': 'effects', 'entity2': 'LPS-inflamed macrophages'}, {'entity1': 'c-MIM-3', 'relationship': 'effects', 'entity2': 'LPS-inflamed granulocytes'}]","<s>[INST] Extract the entities and relationships from the following text: </s>[SYS] User prompt [/INST] In vitro investigations on c-MIM-2 and c-MIM-3 revealed their immune-modulatory effects in LPS-inflamed human monocytes, macrophages, and granulocytes, on the secretion of cytokines such as TNF-α, PGE2, and IL-6. </s> Model answer <s>[{'entity1': 'c-MIM-2', 'relationship': 'effects', 'entity2': 'LPS-inflamed human monocytes'}, {'entity1': 'c-MIM-3', 'relationship': 'effects', 'entity2': 'LPS-inflamed macrophages'}, {'entity1': 'c-MIM-3', 'relationship': 'effects', 'entity2': 'LPS-inflamed granulocytes'}]</s>"
3,"Our in vitro investigations on c-MIM-2 and c-MIM-3 revealed their immune-modulatory effects in LPS-inflamed human monocytes, macrophages, and granulocytes, on the secretion of cytokines such as TNF-α, PGE2, and IL-6.","[{'entity1': 'c-MIM-2 and c-MIM-3', 'relationship': 'revealed', 'entity2': 'immune-modulatory effects'}, {'entity1': 'c-MIM-2 and c-MIM-3', 'relationship': 'in', 'entity2': 'LPS-inflamed human monocytes'}, {'entity1': 'c-MIM-2 and c-MIM-3', 'relationship': 'in', 'entity2': 'macrophages'}, {'entity1': 'c-MIM-2 and c-MIM-3', 'relationship': 'in', 'entity2': 'granulocytes'}, {'entity1': 'c-MIM-2 and c-MIM-3', 'relationship': 'on', 'entity2': 'secretion'}, {'entity1': 'c-MIM-2 and c-MIM-3', 'relationship': 'of', 'entity2': 'cytokines'}, {'entity1': 'cytokines', 'relationship': 'such as', 'entity2': 'TNF-α'}, {'entity1': 'cytokines', 'relationship': 'such as', 'entity2': 'PGE2'}, {'entity1': 'cytokines', 'relationship': 'such as', 'entity2': 'IL-6'}]","<s>[INST] Extract the entities and relationships from the following text: </s>[SYS] User prompt [/INST] Our in vitro investigations on c-MIM-2 and c-MIM-3 revealed their immune-modulatory effects in LPS-inflamed human monocytes, macrophages, and granulocytes, on the secretion of cytokines such as TNF-α, PGE2, and IL-6. </s> Model answer <s>[{'entity1': 'c-MIM-2 and c-MIM-3', 'relationship': 'revealed', 'entity2': 'immune-modulatory effects'}, {'entity1': 'c-MIM-2 and c-MIM-3', 'relationship': 'in', 'entity2': 'LPS-inflamed human monocytes'}, {'entity1': 'c-MIM-2 and c-MIM-3', 'relationship': 'in', 'entity2': 'macrophages'}, {'entity1': 'c-MIM-2 and c-MIM-3', 'relationship': 'in', 'entity2': 'granulocytes'}, {'entity1': 'c-MIM-2 and c-MIM-3', 'relationship': 'on', 'entity2': 'secretion'}, {'entity1': 'c-MIM-2 and c-MIM-3', 'relationship': 'of', 'entity2': 'cytokines'}, {'entity1': 'cytokines', 'relationship': 'such as', 'entity2': 'TNF-α'}, {'entity1': 'cytokines', 'relationship': 'such as', 'entity2': 'PGE2'}, {'entity1': 'cytokines', 'relationship': 'such as', 'entity2': 'IL-6'}]</s>"
4,"c-MIM-4 restored the cell viability of LPS/IFN-γ-inflamed rat cortical neurons, while reducing the secretion of TNF-α in rat glial cells.","[{'entity1': 'c-MIM-4', 'relationship': 'restored', 'entity2': 'cell viability'}, {'entity1': 'c-MIM-4', 'relationship': 'of', 'entity2': 'LPS/IFN-γ-inflamed rat cortical neurons'}, {'entity1': 'c-MIM-4', 'relationship': 'while reducing', 'entity2': 'secretion'}, {'entity1': 'c-MIM-4', 'relationship': 'of', 'entity2': 'TNF-α'}, {'entity1': 'TNF-α', 'relationship': 'in', 'entity2': 'rat glial cells'}]","<s>[INST] Extract the entities and relationships from the following text: </s>[SYS] User prompt [/INST] c-MIM-4 restored the cell viability of LPS/IFN-γ-inflamed rat cortical neurons, while reducing the secretion of TNF-α in rat glial cells. </s> Model answer <s>[{'entity1': 'c-MIM-4', 'relationship': 'restored', 'entity2': 'cell viability'}, {'entity1': 'c-MIM-4', 'relationship': 'of', 'entity2': 'LPS/IFN-γ-inflamed rat cortical neurons'}, {'entity1': 'c-MIM-4', 'relationship': 'while reducing', 'entity2': 'secretion'}, {'entity1': 'c-MIM-4', 'relationship': 'of', 'entity2': 'TNF-α'}, {'entity1': 'TNF-α', 'relationship': 'in', 'entity2': 'rat glial cells'}]</s>"
5,"A therapeutic approach that includes micro-immunotherapy (MI) could thus be of great interest in order to face such concerns. Indeed, MI medicines (MIM) are immune-factor-based medicines, which formulations either encompass a sole active substance (unitary preparations; referred to as u-MIM) or a distinctive combination of several ingredients (complex MIM; referred to as c-MIM).","[{'entity1': 'Micro-immunotherapy', 'relationship': 'includes', 'entity2': 'MI'}, {'entity1': 'MI medicines', 'relationship': 'are', 'entity2': 'immune-factor-based medicines'}, {'entity1': 'formulations', 'relationship': 'encompass', 'entity2': 'sole active substance'}, {'entity1': 'formulations', 'relationship': 'encompass', 'entity2': 'distinctive combination of several ingredients'}]","<s>[INST] Extract the entities and relationships from the following text: </s>[SYS] User prompt [/INST] A therapeutic approach that includes micro-immunotherapy (MI) could thus be of great interest in order to face such concerns. Indeed, MI medicines (MIM) are immune-factor-based medicines, which formulations either encompass a sole active substance (unitary preparations; referred to as u-MIM) or a distinctive combination of several ingredients (complex MIM; referred to as c-MIM). </s> Model answer <s>[{'entity1': 'Micro-immunotherapy', 'relationship': 'includes', 'entity2': 'MI'}, {'entity1': 'MI medicines', 'relationship': 'are', 'entity2': 'immune-factor-based medicines'}, {'entity1': 'formulations', 'relationship': 'encompass', 'entity2': 'sole active substance'}, {'entity1': 'formulations', 'relationship': 'encompass', 'entity2': 'distinctive combination of several ingredients'}]</s>"
6,"These medicines are manufactured in the form of sucrose-lactose pillules impregnated with the corresponding active ingredients, for oromucosal administration, and are intended to be taken in a fasted state.","[{'entity1': 'Medicines', 'relationship': 'manufactured', 'entity2': 'sucrose-lactose pillules'}, {'entity1': 'sucrose-lactose pillules', 'relationship': 'impregnated with', 'entity2': 'active ingredients'}, {'entity1': 'Medicines', 'relationship': 'intended to be taken', 'entity2': 'fasted state'}]","<s>[INST] Extract the entities and relationships from the following text: </s>[SYS] User prompt [/INST] These medicines are manufactured in the form of sucrose-lactose pillules impregnated with the corresponding active ingredients, for oromucosal administration, and are intended to be taken in a fasted state. </s> Model answer <s>[{'entity1': 'Medicines', 'relationship': 'manufactured', 'entity2': 'sucrose-lactose pillules'}, {'entity1': 'sucrose-lactose pillules', 'relationship': 'impregnated with', 'entity2': 'active ingredients'}, {'entity1': 'Medicines', 'relationship': 'intended to be taken', 'entity2': 'fasted state'}]</s>"
