id,input,output,text
3,The study showed that myocardial infarction (MI) is accompanied by an activated inflammatory response and insulin resistance (IR). Strong correlations between interleukin 6 (IL-6) and free fatty acid (FFA) concentrations demonstrate the involvement of nonspecific inflammation factors in IR development in MI patients.,"[{'entity1': 'Myocardial infarction', 'relationship': 'accompanied by', 'entity2': 'Activated inflammatory response'}, {'entity1': 'Myocardial infarction', 'relationship': 'accompanied by', 'entity2': 'Insulin resistance'}, {'entity1': 'Interleukin 6', 'relationship': 'correlations with', 'entity2': 'Free fatty acid concentrations'}, {'entity1': 'Interleukin 6', 'relationship': 'involvement in', 'entity2': 'Nonspecific inflammation factors'}, {'entity1': 'Nonspecific inflammation factors', 'relationship': 'development in', 'entity2': 'Insulin resistance'}]","<s>[INST] Extract the entities and relationships from the following text: </s>[SYS] User prompt [/INST] The study showed that myocardial infarction (MI) is accompanied by an activated inflammatory response and insulin resistance (IR). Strong correlations between interleukin 6 (IL-6) and free fatty acid (FFA) concentrations demonstrate the involvement of nonspecific inflammation factors in IR development in MI patients. </s> Model answer <s>[{'entity1': 'Myocardial infarction', 'relationship': 'accompanied by', 'entity2': 'Activated inflammatory response'}, {'entity1': 'Myocardial infarction', 'relationship': 'accompanied by', 'entity2': 'Insulin resistance'}, {'entity1': 'Interleukin 6', 'relationship': 'correlations with', 'entity2': 'Free fatty acid concentrations'}, {'entity1': 'Interleukin 6', 'relationship': 'involvement in', 'entity2': 'Nonspecific inflammation factors'}, {'entity1': 'Nonspecific inflammation factors', 'relationship': 'development in', 'entity2': 'Insulin resistance'}]</s>"
4,"Insulin resistance is a characteristic feature of type 2 diabetes mellitus (T2DM) and is considered an important stage in its pathogenesis. It is associated with cardiovascular risk factors such as hyperglycemia, dyslipoproteinemia, arterial hypertension, obesity, thrombosis, and smoking.","[{'entity1': 'Insulin resistance', 'relationship': 'characteristic feature of', 'entity2': 'Type 2 diabetes mellitus'}, {'entity1': 'Insulin resistance', 'relationship': 'associated with', 'entity2': 'Cardiovascular risk factors'}, {'entity1': 'Insulin resistance', 'relationship': 'stage in', 'entity2': 'Pathogenesis'}, {'entity1': 'Type 2 diabetes mellitus', 'relationship': 'associated with', 'entity2': 'Cardiovascular risk factors'}]","<s>[INST] Extract the entities and relationships from the following text: </s>[SYS] User prompt [/INST] Insulin resistance is a characteristic feature of type 2 diabetes mellitus (T2DM) and is considered an important stage in its pathogenesis. It is associated with cardiovascular risk factors such as hyperglycemia, dyslipoproteinemia, arterial hypertension, obesity, thrombosis, and smoking. </s> Model answer <s>[{'entity1': 'Insulin resistance', 'relationship': 'characteristic feature of', 'entity2': 'Type 2 diabetes mellitus'}, {'entity1': 'Insulin resistance', 'relationship': 'associated with', 'entity2': 'Cardiovascular risk factors'}, {'entity1': 'Insulin resistance', 'relationship': 'stage in', 'entity2': 'Pathogenesis'}, {'entity1': 'Type 2 diabetes mellitus', 'relationship': 'associated with', 'entity2': 'Cardiovascular risk factors'}]</s>"
5,"The pathogenetic mechanisms of insulin resistance (IR) development in myocardial infarction (MI) patients are unclear. Activation of local inflammation in the area of atherosclerotic lesion and infarct site with enhanced expression of proinflammatory cytokines like interleukin 6 (IL-6) and acute-phase proteins, including C-reactive protein (CRP), are suggested reasons for IR development.","[{'entity1': 'Insulin resistance', 'relationship': 'development in', 'entity2': 'Myocardial infarction patients'}, {'entity1': 'Inflammation', 'relationship': 'activation in', 'entity2': 'Atherosclerotic lesion'}, {'entity1': 'Inflammation', 'relationship': 'activation in', 'entity2': 'Infarct site'}, {'entity1': 'Proinflammatory cytokines', 'relationship': 'enhanced expression in', 'entity2': 'Atherosclerotic lesion'}, {'entity1': 'Proinflammatory cytokines', 'relationship': 'enhanced expression in', 'entity2': 'Infarct site'}]","<s>[INST] Extract the entities and relationships from the following text: </s>[SYS] User prompt [/INST] The pathogenetic mechanisms of insulin resistance (IR) development in myocardial infarction (MI) patients are unclear. Activation of local inflammation in the area of atherosclerotic lesion and infarct site with enhanced expression of proinflammatory cytokines like interleukin 6 (IL-6) and acute-phase proteins, including C-reactive protein (CRP), are suggested reasons for IR development. </s> Model answer <s>[{'entity1': 'Insulin resistance', 'relationship': 'development in', 'entity2': 'Myocardial infarction patients'}, {'entity1': 'Inflammation', 'relationship': 'activation in', 'entity2': 'Atherosclerotic lesion'}, {'entity1': 'Inflammation', 'relationship': 'activation in', 'entity2': 'Infarct site'}, {'entity1': 'Proinflammatory cytokines', 'relationship': 'enhanced expression in', 'entity2': 'Atherosclerotic lesion'}, {'entity1': 'Proinflammatory cytokines', 'relationship': 'enhanced expression in', 'entity2': 'Infarct site'}]</s>"
6,"Proinflammatory factors could be involved in IR development in acute coronary events. The detection of a possible association between metabolic changes, indicators, and nonspecific inflammation markers in MI patients, including those with T2DM, can play a role in the choice of treatment strategy in terms of risk stratification in this category of patients.","[{'entity1': 'Proinflammatory factors', 'relationship': 'involved', 'entity2': 'IR development'}, {'entity1': 'Metabolic changes', 'relationship': 'association', 'entity2': 'Nonspecific inflammation markers'}, {'entity1': 'MI patients', 'relationship': 'inclusion', 'entity2': 'T2DM'}]","<s>[INST] Extract the entities and relationships from the following text: </s>[SYS] User prompt [/INST] Proinflammatory factors could be involved in IR development in acute coronary events. The detection of a possible association between metabolic changes, indicators, and nonspecific inflammation markers in MI patients, including those with T2DM, can play a role in the choice of treatment strategy in terms of risk stratification in this category of patients. </s> Model answer <s>[{'entity1': 'Proinflammatory factors', 'relationship': 'involved', 'entity2': 'IR development'}, {'entity1': 'Metabolic changes', 'relationship': 'association', 'entity2': 'Nonspecific inflammation markers'}, {'entity1': 'MI patients', 'relationship': 'inclusion', 'entity2': 'T2DM'}]</s>"
7,"This study was aimed at assessing the changing levels of the metabolic proinflammation IR markers IL-6, CRP and PAI-1, and their association with presence or absence of T2DM in MI patients during their hospital stay.","[{'entity1': 'Metabolic proinflammation IR markers', 'relationship': 'levels', 'entity2': 'IL-6'}, {'entity1': 'Metabolic proinflammation IR markers', 'relationship': 'levels', 'entity2': 'CRP'}, {'entity1': 'Metabolic proinflammation IR markers', 'relationship': 'levels', 'entity2': 'PAI-1'}, {'entity1': 'Metabolic proinflammation IR markers', 'relationship': 'association', 'entity2': 'T2DM'}, {'entity1': 'MI patients', 'relationship': 'assessment', 'entity2': 'Metabolic proinflammation IR markers'}]","<s>[INST] Extract the entities and relationships from the following text: </s>[SYS] User prompt [/INST] This study was aimed at assessing the changing levels of the metabolic proinflammation IR markers IL-6, CRP and PAI-1, and their association with presence or absence of T2DM in MI patients during their hospital stay. </s> Model answer <s>[{'entity1': 'Metabolic proinflammation IR markers', 'relationship': 'levels', 'entity2': 'IL-6'}, {'entity1': 'Metabolic proinflammation IR markers', 'relationship': 'levels', 'entity2': 'CRP'}, {'entity1': 'Metabolic proinflammation IR markers', 'relationship': 'levels', 'entity2': 'PAI-1'}, {'entity1': 'Metabolic proinflammation IR markers', 'relationship': 'association', 'entity2': 'T2DM'}, {'entity1': 'MI patients', 'relationship': 'assessment', 'entity2': 'Metabolic proinflammation IR markers'}]</s>"
8,"A total of 155 MI patients (95 males and 60 females), mean age 65 ± 4.5 years, and 30 sex- and age-matched volunteers (the control group) with no cardiovascular or endocrine diseases were enrolled in the study.","[{'entity1': 'MI patients', 'relationship': 'enrolled', 'entity2': 'Study'}, {'entity1': 'Control group', 'relationship': 'matched', 'entity2': 'Volunteers'}, {'entity1': 'Cardiovascular diseases', 'relationship': 'excluded', 'entity2': 'Control group'}, {'entity1': 'Endocrine diseases', 'relationship': 'excluded', 'entity2': 'Control group'}]","<s>[INST] Extract the entities and relationships from the following text: </s>[SYS] User prompt [/INST] A total of 155 MI patients (95 males and 60 females), mean age 65 ± 4.5 years, and 30 sex- and age-matched volunteers (the control group) with no cardiovascular or endocrine diseases were enrolled in the study. </s> Model answer <s>[{'entity1': 'MI patients', 'relationship': 'enrolled', 'entity2': 'Study'}, {'entity1': 'Control group', 'relationship': 'matched', 'entity2': 'Volunteers'}, {'entity1': 'Cardiovascular diseases', 'relationship': 'excluded', 'entity2': 'Control group'}, {'entity1': 'Endocrine diseases', 'relationship': 'excluded', 'entity2': 'Control group'}]</s>"
9,"The main demographic characteristics of the study patients are summarized in Table 1. The patient groups were similar in age, sex, main risk factors of ischemic heart disease, comorbidities, and coronary event incidence.","[{'entity1': 'Demographic characteristics', 'relationship': 'summarized', 'entity2': 'Study patients'}, {'entity1': 'Patient groups', 'relationship': 'similar', 'entity2': 'Age'}, {'entity1': 'Patient groups', 'relationship': 'similar', 'entity2': 'Sex'}, {'entity1': 'Patient groups', 'relationship': 'similar', 'entity2': 'Risk factors'}, {'entity1': 'Patient groups', 'relationship': 'similar', 'entity2': 'Comorbidities'}]","<s>[INST] Extract the entities and relationships from the following text: </s>[SYS] User prompt [/INST] The main demographic characteristics of the study patients are summarized in Table 1. The patient groups were similar in age, sex, main risk factors of ischemic heart disease, comorbidities, and coronary event incidence. </s> Model answer <s>[{'entity1': 'Demographic characteristics', 'relationship': 'summarized', 'entity2': 'Study patients'}, {'entity1': 'Patient groups', 'relationship': 'similar', 'entity2': 'Age'}, {'entity1': 'Patient groups', 'relationship': 'similar', 'entity2': 'Sex'}, {'entity1': 'Patient groups', 'relationship': 'similar', 'entity2': 'Risk factors'}, {'entity1': 'Patient groups', 'relationship': 'similar', 'entity2': 'Comorbidities'}]</s>"
10,"Peak CK MB and troponin T levels did not differ between the groups. Peak CK MB levels were 94.03 ± 17.9 U/L and 137.64 ± 41.1 U/L in the diabetic and nondiabetic patients, respectively (P = 0.916); troponin T concentrations were 1.09 ± 0.92 ng/mL and 0.71 ± 0.41 ng/mL in the diabetic and nondiabetic patients, respectively (P = 0.564).","[{'entity1': 'Peak CK MB', 'relationship': 'levels', 'entity2': 'diabetic patients'}, {'entity1': 'Peak CK MB', 'relationship': 'levels', 'entity2': 'nondiabetic patients'}, {'entity1': 'troponin T', 'relationship': 'concentrations', 'entity2': 'diabetic patients'}, {'entity1': 'troponin T', 'relationship': 'concentrations', 'entity2': 'nondiabetic patients'}]","<s>[INST] Extract the entities and relationships from the following text: </s>[SYS] User prompt [/INST] Peak CK MB and troponin T levels did not differ between the groups. Peak CK MB levels were 94.03 ± 17.9 U/L and 137.64 ± 41.1 U/L in the diabetic and nondiabetic patients, respectively (P = 0.916); troponin T concentrations were 1.09 ± 0.92 ng/mL and 0.71 ± 0.41 ng/mL in the diabetic and nondiabetic patients, respectively (P = 0.564). </s> Model answer <s>[{'entity1': 'Peak CK MB', 'relationship': 'levels', 'entity2': 'diabetic patients'}, {'entity1': 'Peak CK MB', 'relationship': 'levels', 'entity2': 'nondiabetic patients'}, {'entity1': 'troponin T', 'relationship': 'concentrations', 'entity2': 'diabetic patients'}, {'entity1': 'troponin T', 'relationship': 'concentrations', 'entity2': 'nondiabetic patients'}]</s>"
11,"The exclusion criteria were age .75 years, clinically significant comorbidities (autoimmune diseases, thyroid or adrenal gland diseases), acute coronary syndrome as a complication of percutaneous coronary intervention, or coronary artery bypass surgery.","[{'entity1': 'exclusion criteria', 'relationship': 'age', 'entity2': '.75 years'}, {'entity1': 'exclusion criteria', 'relationship': 'comorbidities', 'entity2': 'autoimmune diseases'}, {'entity1': 'exclusion criteria', 'relationship': 'comorbidities', 'entity2': 'thyroid diseases'}, {'entity1': 'exclusion criteria', 'relationship': 'comorbidities', 'entity2': 'adrenal gland diseases'}, {'entity1': 'exclusion criteria', 'relationship': 'complication', 'entity2': 'acute coronary syndrome'}, {'entity1': 'exclusion criteria', 'relationship': 'complication', 'entity2': 'percutaneous coronary intervention'}, {'entity1': 'exclusion criteria', 'relationship': 'complication', 'entity2': 'coronary artery bypass surgery'}]","<s>[INST] Extract the entities and relationships from the following text: </s>[SYS] User prompt [/INST] The exclusion criteria were age .75 years, clinically significant comorbidities (autoimmune diseases, thyroid or adrenal gland diseases), acute coronary syndrome as a complication of percutaneous coronary intervention, or coronary artery bypass surgery. </s> Model answer <s>[{'entity1': 'exclusion criteria', 'relationship': 'age', 'entity2': '.75 years'}, {'entity1': 'exclusion criteria', 'relationship': 'comorbidities', 'entity2': 'autoimmune diseases'}, {'entity1': 'exclusion criteria', 'relationship': 'comorbidities', 'entity2': 'thyroid diseases'}, {'entity1': 'exclusion criteria', 'relationship': 'comorbidities', 'entity2': 'adrenal gland diseases'}, {'entity1': 'exclusion criteria', 'relationship': 'complication', 'entity2': 'acute coronary syndrome'}, {'entity1': 'exclusion criteria', 'relationship': 'complication', 'entity2': 'percutaneous coronary intervention'}, {'entity1': 'exclusion criteria', 'relationship': 'complication', 'entity2': 'coronary artery bypass surgery'}]</s>"
12,"The patient groups had a similar incidence of major hospital coronary events. Eighty percent of patients in both groups did not have any signs of acute heart failure, according to the Killip classification upon admission and during the hospital stay; however, more than 50% of patients had arrhythmias and impaired conduction diagnosed according to the established criteria.","[{'entity1': 'patient groups', 'relationship': 'incidence', 'entity2': 'major hospital coronary events'}, {'entity1': 'patients', 'relationship': 'signs', 'entity2': 'acute heart failure'}, {'entity1': 'patients', 'relationship': 'diagnosed', 'entity2': 'arrhythmias'}, {'entity1': 'patients', 'relationship': 'diagnosed', 'entity2': 'impaired conduction'}]","<s>[INST] Extract the entities and relationships from the following text: </s>[SYS] User prompt [/INST] The patient groups had a similar incidence of major hospital coronary events. Eighty percent of patients in both groups did not have any signs of acute heart failure, according to the Killip classification upon admission and during the hospital stay; however, more than 50% of patients had arrhythmias and impaired conduction diagnosed according to the established criteria. </s> Model answer <s>[{'entity1': 'patient groups', 'relationship': 'incidence', 'entity2': 'major hospital coronary events'}, {'entity1': 'patients', 'relationship': 'signs', 'entity2': 'acute heart failure'}, {'entity1': 'patients', 'relationship': 'diagnosed', 'entity2': 'arrhythmias'}, {'entity1': 'patients', 'relationship': 'diagnosed', 'entity2': 'impaired conduction'}]</s>"
13,The groups were similar in the presence/type of coronary artery disease: coronary angiography showed multivessel (more than three vessels) hemodynamically significant coronary artery lesions in both groups. T2DM compensation was evaluated based on glycated hemoglobin levels. Decompensated T2DM was diagnosed in eight (40%) patients.,"[{'entity1': 'groups', 'relationship': 'presence', 'entity2': 'coronary artery disease'}, {'entity1': 'coronary angiography', 'relationship': 'showed', 'entity2': 'multivessel hemodynamically significant coronary artery lesions'}, {'entity1': 'T2DM compensation', 'relationship': 'evaluated', 'entity2': 'glycated hemoglobin levels'}, {'entity1': 'Decompensated T2DM', 'relationship': 'diagnosed', 'entity2': 'patients'}]","<s>[INST] Extract the entities and relationships from the following text: </s>[SYS] User prompt [/INST] The groups were similar in the presence/type of coronary artery disease: coronary angiography showed multivessel (more than three vessels) hemodynamically significant coronary artery lesions in both groups. T2DM compensation was evaluated based on glycated hemoglobin levels. Decompensated T2DM was diagnosed in eight (40%) patients. </s> Model answer <s>[{'entity1': 'groups', 'relationship': 'presence', 'entity2': 'coronary artery disease'}, {'entity1': 'coronary angiography', 'relationship': 'showed', 'entity2': 'multivessel hemodynamically significant coronary artery lesions'}, {'entity1': 'T2DM compensation', 'relationship': 'evaluated', 'entity2': 'glycated hemoglobin levels'}, {'entity1': 'Decompensated T2DM', 'relationship': 'diagnosed', 'entity2': 'patients'}]</s>"
14,The study design was approved by the Institutional Review Board of the Research Institute for Complex Issues of Cardiovascular Diseases; all the individuals signed the informed consent before being enrolled in the study. Therapeutic interventions during the follow-up period are listed in Table 2.,"[{'entity1': 'study design', 'relationship': 'approved by', 'entity2': 'Institutional Review Board'}, {'entity1': 'individuals', 'relationship': 'signed', 'entity2': 'informed consent'}, {'entity1': 'Therapeutic interventions', 'relationship': 'listed in', 'entity2': 'Table 2'}]","<s>[INST] Extract the entities and relationships from the following text: </s>[SYS] User prompt [/INST] The study design was approved by the Institutional Review Board of the Research Institute for Complex Issues of Cardiovascular Diseases; all the individuals signed the informed consent before being enrolled in the study. Therapeutic interventions during the follow-up period are listed in Table 2. </s> Model answer <s>[{'entity1': 'study design', 'relationship': 'approved by', 'entity2': 'Institutional Review Board'}, {'entity1': 'individuals', 'relationship': 'signed', 'entity2': 'informed consent'}, {'entity1': 'Therapeutic interventions', 'relationship': 'listed in', 'entity2': 'Table 2'}]</s>"
15,Assays Serum IL-6 concentrations were measured by enzyme-linked immunosorbent assay at days 1 and 12 from the MI onset,"[{'entity1': 'Serum IL-6 concentrations', 'relationship': 'measured by', 'entity2': 'enzyme-linked immunosorbent assay'}, {'entity1': 'Serum IL-6 concentrations', 'relationship': 'measured at', 'entity2': 'days 1 and 12'}]","<s>[INST] Extract the entities and relationships from the following text: </s>[SYS] User prompt [/INST] Assays Serum IL-6 concentrations were measured by enzyme-linked immunosorbent assay at days 1 and 12 from the MI onset </s> Model answer <s>[{'entity1': 'Serum IL-6 concentrations', 'relationship': 'measured by', 'entity2': 'enzyme-linked immunosorbent assay'}, {'entity1': 'Serum IL-6 concentrations', 'relationship': 'measured at', 'entity2': 'days 1 and 12'}]</s>"
16,"Insulin resistance (IR) is known to be characteristic of type 2 diabetes mellitus, and is regarded as an important mechanism in disease pathogenesis. One of the key pathogenetic mechanisms of IR progression is impaired free fatty acid (FFA) metabolism. Plasminogen-activator inhibitor 1 (PAI-1) and key inflammation markers, ie, interleukin 6 (IL-6) and C-reactive protein (CRP), also play a role.","[{'entity1': 'Insulin resistance', 'relationship': 'characteristic', 'entity2': 'Type 2 diabetes mellitus'}, {'entity1': 'Insulin resistance', 'relationship': 'mechanism', 'entity2': 'disease pathogenesis'}, {'entity1': 'pathogenesis', 'relationship': 'progression', 'entity2': 'Dyslipidemia'}, {'entity1': 'Plasminogen-activator inhibitor 1', 'relationship': 'role', 'entity2': 'Insulin resistance'}, {'entity1': 'Interleukin 6', 'relationship': 'role', 'entity2': 'Insulin resistance'}, {'entity1': 'C-reactive', 'relationship': 'role', 'entity2': 'Insulin resistance'}]","<s>[INST] Extract the entities and relationships from the following text: </s>[SYS] User prompt [/INST] Insulin resistance (IR) is known to be characteristic of type 2 diabetes mellitus, and is regarded as an important mechanism in disease pathogenesis. One of the key pathogenetic mechanisms of IR progression is impaired free fatty acid (FFA) metabolism. Plasminogen-activator inhibitor 1 (PAI-1) and key inflammation markers, ie, interleukin 6 (IL-6) and C-reactive protein (CRP), also play a role. </s> Model answer <s>[{'entity1': 'Insulin resistance', 'relationship': 'characteristic', 'entity2': 'Type 2 diabetes mellitus'}, {'entity1': 'Insulin resistance', 'relationship': 'mechanism', 'entity2': 'disease pathogenesis'}, {'entity1': 'pathogenesis', 'relationship': 'progression', 'entity2': 'Dyslipidemia'}, {'entity1': 'Plasminogen-activator inhibitor 1', 'relationship': 'role', 'entity2': 'Insulin resistance'}, {'entity1': 'Interleukin 6', 'relationship': 'role', 'entity2': 'Insulin resistance'}, {'entity1': 'C-reactive', 'relationship': 'role', 'entity2': 'Insulin resistance'}]</s>"
17,"Among proinflammatory cytokines contributing to IR development, the role of interleukin (IL)-6, which has autocrine and paracrine properties and is involved in insulin reception and free fatty acid (FFA) metabolism regulation, has been extensively studied.","[{'entity1': 'Interleukin 6', 'relationship': 'contributing', 'entity2': 'Insulin resistance'}, {'entity1': 'Interleukin 6', 'relationship': 'involved', 'entity2': 'insulin reception'}, {'entity1': 'Interleukin 6', 'relationship': 'involved', 'entity2': 'Dyslipidemia'}]","<s>[INST] Extract the entities and relationships from the following text: </s>[SYS] User prompt [/INST] Among proinflammatory cytokines contributing to IR development, the role of interleukin (IL)-6, which has autocrine and paracrine properties and is involved in insulin reception and free fatty acid (FFA) metabolism regulation, has been extensively studied. </s> Model answer <s>[{'entity1': 'Interleukin 6', 'relationship': 'contributing', 'entity2': 'Insulin resistance'}, {'entity1': 'Interleukin 6', 'relationship': 'involved', 'entity2': 'insulin reception'}, {'entity1': 'Interleukin 6', 'relationship': 'involved', 'entity2': 'Dyslipidemia'}]</s>"
18,"CRP, serum FFA, and glucose concentrations were measured at the same study time points using standard Thermo Fisher Scientific (Vantaa, Finland) test systems on a Konelab 30i biochemistry analyzer (Thermo Fisher Scientific Oy, Vantaa, Finland). C-peptide and insulin concentrations were measured by enzyme-linked immunosorbent assay with BioMedica (Waterloo, NSW, Australia) and Diagnostic Systems Laboratories (Webster, TX, USA) lab kits, respectively.","[{'entity1': 'CRP', 'relationship': 'measured', 'entity2': 'Insulin resistance'}, {'entity1': 'FFA', 'relationship': 'measured', 'entity2': 'Insulin resistance'}, {'entity1': 'Glucose', 'relationship': 'measured', 'entity2': 'Insulin resistance'}, {'entity1': 'C-peptide', 'relationship': 'measured', 'entity2': 'Insulin resistance'}, {'entity1': 'Insulin', 'relationship': 'measured', 'entity2': 'Insulin resistance'}, {'entity1': 'Plasma PAI-1', 'relationship': 'assessed', 'entity2': 'Insulin resistance'}]","<s>[INST] Extract the entities and relationships from the following text: </s>[SYS] User prompt [/INST] CRP, serum FFA, and glucose concentrations were measured at the same study time points using standard Thermo Fisher Scientific (Vantaa, Finland) test systems on a Konelab 30i biochemistry analyzer (Thermo Fisher Scientific Oy, Vantaa, Finland). C-peptide and insulin concentrations were measured by enzyme-linked immunosorbent assay with BioMedica (Waterloo, NSW, Australia) and Diagnostic Systems Laboratories (Webster, TX, USA) lab kits, respectively. </s> Model answer <s>[{'entity1': 'CRP', 'relationship': 'measured', 'entity2': 'Insulin resistance'}, {'entity1': 'FFA', 'relationship': 'measured', 'entity2': 'Insulin resistance'}, {'entity1': 'Glucose', 'relationship': 'measured', 'entity2': 'Insulin resistance'}, {'entity1': 'C-peptide', 'relationship': 'measured', 'entity2': 'Insulin resistance'}, {'entity1': 'Insulin', 'relationship': 'measured', 'entity2': 'Insulin resistance'}, {'entity1': 'Plasma PAI-1', 'relationship': 'assessed', 'entity2': 'Insulin resistance'}]</s>"
