id,input,output,text
0,"Inflammation is a biological response of the immune system that can be triggered by a variety of factors, including pathogens, damaged cells and toxic compounds. These factors may induce acute and/or chronic inflammatory responses in the heart, pancreas, liver, kidney, lung, brain, intestinal tract and reproductive system, potentially leading to tissue damage or disease.","[{'entity1': 'Inflammation', 'relationship': 'response', 'entity2': 'immune system'}, {'entity1': 'Inflammation', 'relationship': 'triggered by', 'entity2': 'factors'}, {'entity1': 'factors', 'relationship': 'induce', 'entity2': 'inflammatory responses'}, {'entity1': 'Inflammation', 'relationship': 'lead to', 'entity2': 'tissue damage'}, {'entity1': 'Inflammation', 'relationship': 'lead to', 'entity2': 'disease'}]","<s>[INST] Extract the entities and relationships from the following text: </s>[SYS] User prompt [/INST] Inflammation is a biological response of the immune system that can be triggered by a variety of factors, including pathogens, damaged cells and toxic compounds. These factors may induce acute and/or chronic inflammatory responses in the heart, pancreas, liver, kidney, lung, brain, intestinal tract and reproductive system, potentially leading to tissue damage or disease. </s> Model answer <s>[{'entity1': 'Inflammation', 'relationship': 'response', 'entity2': 'immune system'}, {'entity1': 'Inflammation', 'relationship': 'triggered by', 'entity2': 'factors'}, {'entity1': 'factors', 'relationship': 'induce', 'entity2': 'inflammatory responses'}, {'entity1': 'Inflammation', 'relationship': 'lead to', 'entity2': 'tissue damage'}, {'entity1': 'Inflammation', 'relationship': 'lead to', 'entity2': 'disease'}]</s>"
1,"Both infectious and non-infectious agents and cell damage activate inflammatory cells and trigger inflammatory signaling pathways, most commonly the NF-κB, MAPK, and JAK-STAT pathways.","[{'entity1': 'agents', 'relationship': 'activate', 'entity2': 'inflammatory cells'}, {'entity1': 'agents', 'relationship': 'trigger', 'entity2': 'signaling pathways'}, {'entity1': 'agents', 'relationship': 'infectious', 'entity2': 'inflammatory cells'}, {'entity1': 'agents', 'relationship': 'non-infectious', 'entity2': 'inflammatory cells'}, {'entity1': 'cell damage', 'relationship': 'activate', 'entity2': 'inflammatory cells'}]","<s>[INST] Extract the entities and relationships from the following text: </s>[SYS] User prompt [/INST] Both infectious and non-infectious agents and cell damage activate inflammatory cells and trigger inflammatory signaling pathways, most commonly the NF-κB, MAPK, and JAK-STAT pathways. </s> Model answer <s>[{'entity1': 'agents', 'relationship': 'activate', 'entity2': 'inflammatory cells'}, {'entity1': 'agents', 'relationship': 'trigger', 'entity2': 'signaling pathways'}, {'entity1': 'agents', 'relationship': 'infectious', 'entity2': 'inflammatory cells'}, {'entity1': 'agents', 'relationship': 'non-infectious', 'entity2': 'inflammatory cells'}, {'entity1': 'cell damage', 'relationship': 'activate', 'entity2': 'inflammatory cells'}]</s>"
2,"Inflammation is the immune system’s response to harmful stimuli, such as pathogens, damaged cells, toxic compounds, or irradiation, and acts by removing injurious stimuli and initiating the healing process.","[{'entity1': 'Inflammation', 'relationship': 'response to', 'entity2': 'stimuli'}, {'entity1': 'Inflammation', 'relationship': 'acts by', 'entity2': 'removing stimuli'}, {'entity1': 'Inflammation', 'relationship': 'acts by', 'entity2': 'initiating healing process'}]","<s>[INST] Extract the entities and relationships from the following text: </s>[SYS] User prompt [/INST] Inflammation is the immune system’s response to harmful stimuli, such as pathogens, damaged cells, toxic compounds, or irradiation, and acts by removing injurious stimuli and initiating the healing process. </s> Model answer <s>[{'entity1': 'Inflammation', 'relationship': 'response to', 'entity2': 'stimuli'}, {'entity1': 'Inflammation', 'relationship': 'acts by', 'entity2': 'removing stimuli'}, {'entity1': 'Inflammation', 'relationship': 'acts by', 'entity2': 'initiating healing process'}]</s>"
3,"Inflammation is therefore a defense mechanism that is vital to health. Usually, during acute inflammatory responses, cellular and molecular events and interactions efficiently minimize impending injury or infection.","[{'entity1': 'Inflammation', 'relationship': 'defense mechanism', 'entity2': 'health'}, {'entity1': 'Inflammation', 'relationship': 'minimize', 'entity2': 'injury'}, {'entity1': 'Inflammation', 'relationship': 'minimize', 'entity2': 'infection'}]","<s>[INST] Extract the entities and relationships from the following text: </s>[SYS] User prompt [/INST] Inflammation is therefore a defense mechanism that is vital to health. Usually, during acute inflammatory responses, cellular and molecular events and interactions efficiently minimize impending injury or infection. </s> Model answer <s>[{'entity1': 'Inflammation', 'relationship': 'defense mechanism', 'entity2': 'health'}, {'entity1': 'Inflammation', 'relationship': 'minimize', 'entity2': 'injury'}, {'entity1': 'Inflammation', 'relationship': 'minimize', 'entity2': 'infection'}]</s>"
4,"However, uncontrolled acute inflammation may become chronic, contributing to a variety of chronic inflammatory diseases.","[{'entity1': 'acute inflammation', 'relationship': 'become', 'entity2': 'chronic'}, {'entity1': 'acute inflammation', 'relationship': 'contribute to', 'entity2': 'inflammatory diseases'}]","<s>[INST] Extract the entities and relationships from the following text: </s>[SYS] User prompt [/INST] However, uncontrolled acute inflammation may become chronic, contributing to a variety of chronic inflammatory diseases. </s> Model answer <s>[{'entity1': 'acute inflammation', 'relationship': 'become', 'entity2': 'chronic'}, {'entity1': 'acute inflammation', 'relationship': 'contribute to', 'entity2': 'inflammatory diseases'}]</s>"
5,"At the tissue level, inflammation is characterized by redness, swelling, heat, pain, and loss of tissue function, which result from local immune, vascular and inflammatory cell responses to infection or injury.","[{'entity1': 'Inflammation', 'relationship': 'characterized by', 'entity2': 'redness'}, {'entity1': 'Inflammation', 'relationship': 'characterized by', 'entity2': 'swelling'}, {'entity1': 'Inflammation', 'relationship': 'characterized by', 'entity2': 'heat'}, {'entity1': 'Inflammation', 'relationship': 'characterized by', 'entity2': 'pain'}, {'entity1': 'Inflammation', 'relationship': 'result from', 'entity2': 'immune responses'}, {'entity1': 'Inflammation', 'relationship': 'result from', 'entity2': 'vascular responses'}, {'entity1': 'Inflammation', 'relationship': 'result from', 'entity2': 'inflammatory cell responses'}]","<s>[INST] Extract the entities and relationships from the following text: </s>[SYS] User prompt [/INST] At the tissue level, inflammation is characterized by redness, swelling, heat, pain, and loss of tissue function, which result from local immune, vascular and inflammatory cell responses to infection or injury. </s> Model answer <s>[{'entity1': 'Inflammation', 'relationship': 'characterized by', 'entity2': 'redness'}, {'entity1': 'Inflammation', 'relationship': 'characterized by', 'entity2': 'swelling'}, {'entity1': 'Inflammation', 'relationship': 'characterized by', 'entity2': 'heat'}, {'entity1': 'Inflammation', 'relationship': 'characterized by', 'entity2': 'pain'}, {'entity1': 'Inflammation', 'relationship': 'result from', 'entity2': 'immune responses'}, {'entity1': 'Inflammation', 'relationship': 'result from', 'entity2': 'vascular responses'}, {'entity1': 'Inflammation', 'relationship': 'result from', 'entity2': 'inflammatory cell responses'}]</s>"
6,"Important microcirculatory events that occur during the inflammatory process include vascular permeability changes, leukocyte recruitment and accumulation, and inflammatory mediator release.","[{'entity1': 'microcirculatory events', 'relationship': 'occur during', 'entity2': 'inflammatory process'}, {'entity1': 'events', 'relationship': 'include', 'entity2': 'permeability changes'}, {'entity1': 'events', 'relationship': 'include', 'entity2': 'leukocyte recruitment'}, {'entity1': 'events', 'relationship': 'include', 'entity2': 'inflammatory mediator release'}]","<s>[INST] Extract the entities and relationships from the following text: </s>[SYS] User prompt [/INST] Important microcirculatory events that occur during the inflammatory process include vascular permeability changes, leukocyte recruitment and accumulation, and inflammatory mediator release. </s> Model answer <s>[{'entity1': 'microcirculatory events', 'relationship': 'occur during', 'entity2': 'inflammatory process'}, {'entity1': 'events', 'relationship': 'include', 'entity2': 'permeability changes'}, {'entity1': 'events', 'relationship': 'include', 'entity2': 'leukocyte recruitment'}, {'entity1': 'events', 'relationship': 'include', 'entity2': 'inflammatory mediator release'}]</s>"
7,"Various pathogenic factors, such as infection, tissue injury, or cardiac infarction, can induce inflammation by causing tissue damage.","[{'entity1': 'pathogenic factors', 'relationship': 'induce', 'entity2': 'inflammation'}, {'entity1': 'pathogenic factors', 'relationship': 'cause', 'entity2': 'tissue damage'}, {'entity1': 'infection', 'relationship': 'induce', 'entity2': 'inflammation'}, {'entity1': 'tissue injury', 'relationship': 'induce', 'entity2': 'inflammation'}, {'entity1': 'cardiac infarction', 'relationship': 'induce', 'entity2': 'inflammation'}]","<s>[INST] Extract the entities and relationships from the following text: </s>[SYS] User prompt [/INST] Various pathogenic factors, such as infection, tissue injury, or cardiac infarction, can induce inflammation by causing tissue damage. </s> Model answer <s>[{'entity1': 'pathogenic factors', 'relationship': 'induce', 'entity2': 'inflammation'}, {'entity1': 'pathogenic factors', 'relationship': 'cause', 'entity2': 'tissue damage'}, {'entity1': 'infection', 'relationship': 'induce', 'entity2': 'inflammation'}, {'entity1': 'tissue injury', 'relationship': 'induce', 'entity2': 'inflammation'}, {'entity1': 'cardiac infarction', 'relationship': 'induce', 'entity2': 'inflammation'}]</s>"
8,"The etiologies of inflammation can be infectious or non-infectious. In response to tissue injury, the body initiates a chemical signaling cascade that stimulates responses aimed at healing affected tissues.","[{'entity1': 'etiologies', 'relationship': 'infectious', 'entity2': 'inflammation'}, {'entity1': 'etiologies', 'relationship': 'non-infectious', 'entity2': 'inflammation'}, {'entity1': 'tissue injury', 'relationship': 'initiates', 'entity2': 'signaling cascade'}, {'entity1': 'signaling cascade', 'relationship': 'stimulates', 'entity2': 'responses'}, {'entity1': 'responses', 'relationship': 'aimed at', 'entity2': 'healing tissues'}]","<s>[INST] Extract the entities and relationships from the following text: </s>[SYS] User prompt [/INST] The etiologies of inflammation can be infectious or non-infectious. In response to tissue injury, the body initiates a chemical signaling cascade that stimulates responses aimed at healing affected tissues. </s> Model answer <s>[{'entity1': 'etiologies', 'relationship': 'infectious', 'entity2': 'inflammation'}, {'entity1': 'etiologies', 'relationship': 'non-infectious', 'entity2': 'inflammation'}, {'entity1': 'tissue injury', 'relationship': 'initiates', 'entity2': 'signaling cascade'}, {'entity1': 'signaling cascade', 'relationship': 'stimulates', 'entity2': 'responses'}, {'entity1': 'responses', 'relationship': 'aimed at', 'entity2': 'healing tissues'}]</s>"
9,"The inflammatory response is the coordinate activation of signaling pathways in inflammatory mediator levels in resident tissue cells and inflammatory cells recruited from the blood. Inflammation is a common pathogenesis of many chronic diseases, including cardiovascular and bowel diseases, diabetes, arthritis, and cancer.","[{'entity1': 'Inflammatory response', 'relationship': 'activation', 'entity2': 'signaling pathways'}, {'entity1': 'Inflammatory response', 'relationship': 'pathogenesis', 'entity2': 'Chronic diseases'}, {'entity1': 'Inflammatory response', 'relationship': 'pathogenesis', 'entity2': 'Cardiovascular diseases'}, {'entity1': 'Inflammatory response', 'relationship': 'pathogenesis', 'entity2': 'Diabetes'}, {'entity1': 'Inflammatory response', 'relationship': 'pathogenesis', 'entity2': 'Arthritis'}, {'entity1': 'Inflammatory response', 'relationship': 'pathogenesis', 'entity2': 'Cancer'}]","<s>[INST] Extract the entities and relationships from the following text: </s>[SYS] User prompt [/INST] The inflammatory response is the coordinate activation of signaling pathways in inflammatory mediator levels in resident tissue cells and inflammatory cells recruited from the blood. Inflammation is a common pathogenesis of many chronic diseases, including cardiovascular and bowel diseases, diabetes, arthritis, and cancer. </s> Model answer <s>[{'entity1': 'Inflammatory response', 'relationship': 'activation', 'entity2': 'signaling pathways'}, {'entity1': 'Inflammatory response', 'relationship': 'pathogenesis', 'entity2': 'Chronic diseases'}, {'entity1': 'Inflammatory response', 'relationship': 'pathogenesis', 'entity2': 'Cardiovascular diseases'}, {'entity1': 'Inflammatory response', 'relationship': 'pathogenesis', 'entity2': 'Diabetes'}, {'entity1': 'Inflammatory response', 'relationship': 'pathogenesis', 'entity2': 'Arthritis'}, {'entity1': 'Inflammatory response', 'relationship': 'pathogenesis', 'entity2': 'Cancer'}]</s>"
10,Pattern recognition receptor activation involves microbial structures known as pathogen-associated molecular patterns (PAMPs) triggering the inflammatory response through activation of germline-encoded pattern-recognition receptors (PRRs) expressed in both immune and nonimmune cells.,"[{'entity1': 'Pattern recognition receptor activation', 'relationship': 'involves', 'entity2': 'Microbial structures'}, {'entity1': 'Pattern recognition receptor activation', 'relationship': 'triggers', 'entity2': 'Inflammatory response'}, {'entity1': 'Pattern recognition receptor activation', 'relationship': 'activation', 'entity2': 'Pattern-recognition receptors'}, {'entity1': 'Pattern recognition receptor activation', 'relationship': 'expressed', 'entity2': 'Immune cells'}, {'entity1': 'Pattern recognition receptor activation', 'relationship': 'expressed', 'entity2': 'Nonimmune cells'}]","<s>[INST] Extract the entities and relationships from the following text: </s>[SYS] User prompt [/INST] Pattern recognition receptor activation involves microbial structures known as pathogen-associated molecular patterns (PAMPs) triggering the inflammatory response through activation of germline-encoded pattern-recognition receptors (PRRs) expressed in both immune and nonimmune cells. </s> Model answer <s>[{'entity1': 'Pattern recognition receptor activation', 'relationship': 'involves', 'entity2': 'Microbial structures'}, {'entity1': 'Pattern recognition receptor activation', 'relationship': 'triggers', 'entity2': 'Inflammatory response'}, {'entity1': 'Pattern recognition receptor activation', 'relationship': 'activation', 'entity2': 'Pattern-recognition receptors'}, {'entity1': 'Pattern recognition receptor activation', 'relationship': 'expressed', 'entity2': 'Immune cells'}, {'entity1': 'Pattern recognition receptor activation', 'relationship': 'expressed', 'entity2': 'Nonimmune cells'}]</s>"
11,"TLRs are a family of highly conserved, mammalian PRRs that participate in the activation of the inflammatory response. More than ten members of the TLR family have been identified, and TLRs are the most well-studied of the known PRRs.","[{'entity1': 'TLRs', 'relationship': 'participate', 'entity2': 'Inflammatory response'}, {'entity1': 'TLRs', 'relationship': 'identified', 'entity2': 'Members'}, {'entity1': 'TLRs', 'relationship': 'studied', 'entity2': 'PRRs'}]","<s>[INST] Extract the entities and relationships from the following text: </s>[SYS] User prompt [/INST] TLRs are a family of highly conserved, mammalian PRRs that participate in the activation of the inflammatory response. More than ten members of the TLR family have been identified, and TLRs are the most well-studied of the known PRRs. </s> Model answer <s>[{'entity1': 'TLRs', 'relationship': 'participate', 'entity2': 'Inflammatory response'}, {'entity1': 'TLRs', 'relationship': 'identified', 'entity2': 'Members'}, {'entity1': 'TLRs', 'relationship': 'studied', 'entity2': 'PRRs'}]</s>"
12,"Inflammatory pathways impact the pathogenesis of a number of chronic diseases, and involve common inflammatory mediators and regulatory pathways. Inflammatory stimuli activate intracellular signaling pathways that then activate production of inflammatory mediators. Primary inflammatory stimuli, including microbial products and cytokines such as interleukin-1β (IL-1β), interleukin-6 (IL-6), and tumor necrosis factor-α (TNF-α), mediate inflammation through interaction with the TLRs, IL-1 receptor (IL-1R), IL-6 receptor (IL-6R), and the TNF receptor (TNFR). Receptor activation triggers important intracellular signaling pathways, including the mitogen-activated protein kinase (MAPK), nuclear factor kappa-B (NF-κB), and Janus kinase (JAK)-signal transducer and activator of transcription (STAT) pathways.","[{'entity1': 'Inflammatory pathways', 'relationship': 'impact', 'entity2': 'pathogenesis of chronic diseases'}, {'entity1': 'Inflammatory stimuli', 'relationship': 'activate', 'entity2': 'intracellular signaling pathways'}, {'entity1': 'Interleukin-1β', 'relationship': 'mediate', 'entity2': 'inflammation'}, {'entity1': 'Interleukin-6', 'relationship': 'mediate', 'entity2': 'inflammation'}, {'entity1': 'Tumor necrosis factor-α', 'relationship': 'mediate', 'entity2': 'inflammation'}, {'entity1': 'Interleukin-1R', 'relationship': 'interaction with', 'entity2': 'Inflammatory stimuli'}, {'entity1': 'IL-6R', 'relationship': 'interaction with', 'entity2': 'Inflammatory stimuli'}, {'entity1': 'TNFR', 'relationship': 'interaction with', 'entity2': 'Inflammatory stimuli'}, {'entity1': 'Receptor activation', 'relationship': 'triggers', 'entity2': 'intracellular signaling pathways'}, {'entity1': 'NF-κB', 'relationship': 'important roles in', 'entity2': 'inflammatory response'}, {'entity1': 'NF-κB', 'relationship': 'important roles in', 'entity2': 'immune response'}, {'entity1': 'NF-κB', 'relationship': 'important roles in', 'entity2': 'survival processes'}, {'entity1': 'NF-κB', 'relationship': 'important roles in', 'entity2': 'apoptosis processes'}, {'entity1': 'NF-κB', 'relationship': 'activity induced by', 'entity2': 'stimuli'}, {'entity1': 'IκB proteins', 'relationship': 'inhibit', 'entity2': 'NF-κB'}, {'entity1': 'PRRs', 'relationship': 'activate', 'entity2': 'IκB kinase'}, {'entity1': 'IKK', 'relationship': 'regulates', 'entity2': 'NF-κB pathway activation'}, {'entity1': 'IκB phosphorylation', 'relationship': 'results in', 'entity2': 'degradation by proteasome'}, {'entity1': 'NF-κB', 'relationship': 'release for', 'entity2': 'nuclear translocation'}, {'entity1': 'NF-κB', 'relationship': 'release for', 'entity2': 'gene transcription activation'}, {'entity1': 'NF-κB pathway', 'relationship': 'regulates', 'entity2': 'pro-inflammatory cytokine production'}, {'entity1': 'NF-κB pathway', 'relationship': 'regulates', 'entity2': 'inflammatory cell recruitment'}, {'entity1': 'MAPK', 'relationship': 'comprises', 'entity2': 'MAPK kinase'}, {'entity1': 'MAPK', 'relationship': 'comprises', 'entity2': 'MAPK kinase kinase'}, {'entity1': 'ERK1/2', 'relationship': 'activated by', 'entity2': 'mitogens'}, {'entity1': 'ERK1/2', 'relationship': 'activated by', 'entity2': 'differentiation signals'}, {'entity1': 'JNK', 'relationship': 'activated by', 'entity2': 'inflammatory stimuli'}, {'entity1': 'JNK', 'relationship': 'activated by', 'entity2': 'stress'}, {'entity1': 'MKK1', 'relationship': 'activate', 'entity2': 'ERK1/2'}, {'entity1': 'MKK2', 'relationship': 'activate', 'entity2': 'ERK1/2'}, {'entity1': 'MKK4', 'relationship': 'activate', 'entity2': 'JNK'}, {'entity1': 'MKK7', 'relationship': 'activate', 'entity2': 'JNK'}, {'entity1': 'MKK3', 'relationship': 'activate', 'entity2': 'p38'}, {'entity1': 'MKK6', 'relationship': 'activate', 'entity2': 'p38'}]","<s>[INST] Extract the entities and relationships from the following text: </s>[SYS] User prompt [/INST] Inflammatory pathways impact the pathogenesis of a number of chronic diseases, and involve common inflammatory mediators and regulatory pathways. Inflammatory stimuli activate intracellular signaling pathways that then activate production of inflammatory mediators. Primary inflammatory stimuli, including microbial products and cytokines such as interleukin-1β (IL-1β), interleukin-6 (IL-6), and tumor necrosis factor-α (TNF-α), mediate inflammation through interaction with the TLRs, IL-1 receptor (IL-1R), IL-6 receptor (IL-6R), and the TNF receptor (TNFR). Receptor activation triggers important intracellular signaling pathways, including the mitogen-activated protein kinase (MAPK), nuclear factor kappa-B (NF-κB), and Janus kinase (JAK)-signal transducer and activator of transcription (STAT) pathways. </s> Model answer <s>[{'entity1': 'Inflammatory pathways', 'relationship': 'impact', 'entity2': 'pathogenesis of chronic diseases'}, {'entity1': 'Inflammatory stimuli', 'relationship': 'activate', 'entity2': 'intracellular signaling pathways'}, {'entity1': 'Interleukin-1β', 'relationship': 'mediate', 'entity2': 'inflammation'}, {'entity1': 'Interleukin-6', 'relationship': 'mediate', 'entity2': 'inflammation'}, {'entity1': 'Tumor necrosis factor-α', 'relationship': 'mediate', 'entity2': 'inflammation'}, {'entity1': 'Interleukin-1R', 'relationship': 'interaction with', 'entity2': 'Inflammatory stimuli'}, {'entity1': 'IL-6R', 'relationship': 'interaction with', 'entity2': 'Inflammatory stimuli'}, {'entity1': 'TNFR', 'relationship': 'interaction with', 'entity2': 'Inflammatory stimuli'}, {'entity1': 'Receptor activation', 'relationship': 'triggers', 'entity2': 'intracellular signaling pathways'}, {'entity1': 'NF-κB', 'relationship': 'important roles in', 'entity2': 'inflammatory response'}, {'entity1': 'NF-κB', 'relationship': 'important roles in', 'entity2': 'immune response'}, {'entity1': 'NF-κB', 'relationship': 'important roles in', 'entity2': 'survival processes'}, {'entity1': 'NF-κB', 'relationship': 'important roles in', 'entity2': 'apoptosis processes'}, {'entity1': 'NF-κB', 'relationship': 'activity induced by', 'entity2': 'stimuli'}, {'entity1': 'IκB proteins', 'relationship': 'inhibit', 'entity2': 'NF-κB'}, {'entity1': 'PRRs', 'relationship': 'activate', 'entity2': 'IκB kinase'}, {'entity1': 'IKK', 'relationship': 'regulates', 'entity2': 'NF-κB pathway activation'}, {'entity1': 'IκB phosphorylation', 'relationship': 'results in', 'entity2': 'degradation by proteasome'}, {'entity1': 'NF-κB', 'relationship': 'release for', 'entity2': 'nuclear translocation'}, {'entity1': 'NF-κB', 'relationship': 'release for', 'entity2': 'gene transcription activation'}, {'entity1': 'NF-κB pathway', 'relationship': 'regulates', 'entity2': 'pro-inflammatory cytokine production'}, {'entity1': 'NF-κB pathway', 'relationship': 'regulates', 'entity2': 'inflammatory cell recruitment'}, {'entity1': 'MAPK', 'relationship': 'comprises', 'entity2': 'MAPK kinase'}, {'entity1': 'MAPK', 'relationship': 'comprises', 'entity2': 'MAPK kinase kinase'}, {'entity1': 'ERK1/2', 'relationship': 'activated by', 'entity2': 'mitogens'}, {'entity1': 'ERK1/2', 'relationship': 'activated by', 'entity2': 'differentiation signals'}, {'entity1': 'JNK', 'relationship': 'activated by', 'entity2': 'inflammatory stimuli'}, {'entity1': 'JNK', 'relationship': 'activated by', 'entity2': 'stress'}, {'entity1': 'MKK1', 'relationship': 'activate', 'entity2': 'ERK1/2'}, {'entity1': 'MKK2', 'relationship': 'activate', 'entity2': 'ERK1/2'}, {'entity1': 'MKK4', 'relationship': 'activate', 'entity2': 'JNK'}, {'entity1': 'MKK7', 'relationship': 'activate', 'entity2': 'JNK'}, {'entity1': 'MKK3', 'relationship': 'activate', 'entity2': 'p38'}, {'entity1': 'MKK6', 'relationship': 'activate', 'entity2': 'p38'}]</s>"
