id,input,output,text
15,"The Eup group was treated only with 10 μM Eupatilin, which was added the same time as LPS+ Eup group.","[{'entity1': 'Eup group', 'relationship': 'treated with', 'entity2': 'Eupatilin'}, {'entity1': 'Eup group', 'relationship': 'added with', 'entity2': 'LPS+ Eup group'}]","<s>[INST] Extract the entities and relationships from the following text: </s>[SYS] User prompt [/INST] The Eup group was treated only with 10 μM Eupatilin, which was added the same time as LPS+ Eup group. </s> Model answer <s>[{'entity1': 'Eup group', 'relationship': 'treated with', 'entity2': 'Eupatilin'}, {'entity1': 'Eup group', 'relationship': 'added with', 'entity2': 'LPS+ Eup group'}]</s>"
16,The effects of Eupatilin on the proliferation of RAW264.7 macrophages were assessed using the CCK-8 assay.,"[{'entity1': 'Eupatilin', 'relationship': 'affects', 'entity2': 'proliferation'}, {'entity1': 'RAW264.7 macrophages', 'relationship': 'assessed by', 'entity2': 'CCK-8 assay'}]","<s>[INST] Extract the entities and relationships from the following text: </s>[SYS] User prompt [/INST] The effects of Eupatilin on the proliferation of RAW264.7 macrophages were assessed using the CCK-8 assay. </s> Model answer <s>[{'entity1': 'Eupatilin', 'relationship': 'affects', 'entity2': 'proliferation'}, {'entity1': 'RAW264.7 macrophages', 'relationship': 'assessed by', 'entity2': 'CCK-8 assay'}]</s>"
17,"The day before stimulation, RAW264.7 cells were seeded in a 96-well plate at a density of 1.0×104 cells/well.","[{'entity1': 'RAW264.7 cells', 'relationship': 'seeded in', 'entity2': '96-well plate'}, {'entity1': 'RAW264.7 cells', 'relationship': 'density', 'entity2': '1.0×104 cells/well'}]","<s>[INST] Extract the entities and relationships from the following text: </s>[SYS] User prompt [/INST] The day before stimulation, RAW264.7 cells were seeded in a 96-well plate at a density of 1.0×104 cells/well. </s> Model answer <s>[{'entity1': 'RAW264.7 cells', 'relationship': 'seeded in', 'entity2': '96-well plate'}, {'entity1': 'RAW264.7 cells', 'relationship': 'density', 'entity2': '1.0×104 cells/well'}]</s>"
18,"The RT-qPCR was performed using SYBR Green on a PCR detection system (7500fast, USA).","[{'entity1': 'RT-qPCR', 'relationship': 'performed using', 'entity2': 'SYBR Green'}, {'entity1': 'PCR detection system', 'relationship': 'used for', 'entity2': 'RT-qPCR'}]","<s>[INST] Extract the entities and relationships from the following text: </s>[SYS] User prompt [/INST] The RT-qPCR was performed using SYBR Green on a PCR detection system (7500fast, USA). </s> Model answer <s>[{'entity1': 'RT-qPCR', 'relationship': 'performed using', 'entity2': 'SYBR Green'}, {'entity1': 'PCR detection system', 'relationship': 'used for', 'entity2': 'RT-qPCR'}]</s>"
19,We obtained male C57BL/6 mice at the age of 6–8 weeks and the weight of 18–25 g from Shanghai SLAC Laboratory.,"[{'entity1': 'Male C57BL/6 mice', 'relationship': 'obtained from', 'entity2': 'Shanghai SLAC Laboratory'}, {'entity1': 'Male C57BL/6 mice', 'relationship': 'age', 'entity2': '6–8 weeks'}, {'entity1': 'Male C57BL/6 mice', 'relationship': 'weight', 'entity2': '18–25 g'}]","<s>[INST] Extract the entities and relationships from the following text: </s>[SYS] User prompt [/INST] We obtained male C57BL/6 mice at the age of 6–8 weeks and the weight of 18–25 g from Shanghai SLAC Laboratory. </s> Model answer <s>[{'entity1': 'Male C57BL/6 mice', 'relationship': 'obtained from', 'entity2': 'Shanghai SLAC Laboratory'}, {'entity1': 'Male C57BL/6 mice', 'relationship': 'age', 'entity2': '6–8 weeks'}, {'entity1': 'Male C57BL/6 mice', 'relationship': 'weight', 'entity2': '18–25 g'}]</s>"
20,"The mice were randomly assigned into three groups according to the random number table method: sham operation (SHAM) group, CLP group, CLP + Eup group. After the processing time, each group contained more than six samples. The mice were anesthetized by 1% sodium pentobarbital (Solarbio, China) according to their weight (100 μL/10 g) before operation.","[{'entity1': 'mice', 'relationship': 'assigned', 'entity2': 'groups'}, {'entity1': 'groups', 'relationship': 'contained', 'entity2': 'samples'}, {'entity1': 'mice', 'relationship': 'anesthetized', 'entity2': 'sodium pentobarbital'}, {'entity1': 'sodium pentobarbital', 'relationship': 'administered', 'entity2': 'mice'}]","<s>[INST] Extract the entities and relationships from the following text: </s>[SYS] User prompt [/INST] The mice were randomly assigned into three groups according to the random number table method: sham operation (SHAM) group, CLP group, CLP + Eup group. After the processing time, each group contained more than six samples. The mice were anesthetized by 1% sodium pentobarbital (Solarbio, China) according to their weight (100 μL/10 g) before operation. </s> Model answer <s>[{'entity1': 'mice', 'relationship': 'assigned', 'entity2': 'groups'}, {'entity1': 'groups', 'relationship': 'contained', 'entity2': 'samples'}, {'entity1': 'mice', 'relationship': 'anesthetized', 'entity2': 'sodium pentobarbital'}, {'entity1': 'sodium pentobarbital', 'relationship': 'administered', 'entity2': 'mice'}]</s>"
21,"After the mice were anesthetized, we opened the abdominal cavity and carefully exposed the cecum, which was then ligated at 1 cm from the end and punched through by a needle (21-gauge). Subsequently, the feces were squeezed out into the abdomen and the cecum was placed back. Finally, the abdominal cavity was closed.","[{'entity1': 'mice', 'relationship': 'exposed', 'entity2': 'cecum'}, {'entity1': 'cecum', 'relationship': 'ligated', 'entity2': 'end'}, {'entity1': 'cecum', 'relationship': 'punched through', 'entity2': 'needle'}, {'entity1': 'feces', 'relationship': 'squeezed out', 'entity2': 'abdomen'}, {'entity1': 'abdominal cavity', 'relationship': 'closed', 'entity2': 'cecum'}]","<s>[INST] Extract the entities and relationships from the following text: </s>[SYS] User prompt [/INST] After the mice were anesthetized, we opened the abdominal cavity and carefully exposed the cecum, which was then ligated at 1 cm from the end and punched through by a needle (21-gauge). Subsequently, the feces were squeezed out into the abdomen and the cecum was placed back. Finally, the abdominal cavity was closed. </s> Model answer <s>[{'entity1': 'mice', 'relationship': 'exposed', 'entity2': 'cecum'}, {'entity1': 'cecum', 'relationship': 'ligated', 'entity2': 'end'}, {'entity1': 'cecum', 'relationship': 'punched through', 'entity2': 'needle'}, {'entity1': 'feces', 'relationship': 'squeezed out', 'entity2': 'abdomen'}, {'entity1': 'abdominal cavity', 'relationship': 'closed', 'entity2': 'cecum'}]</s>"
22,"Similar procedures without ligation and puncture were used in the SHAM group. For the CLP+Eup group, the mice were administered Eupatilin (10mg/kg) by gavage 2 hours before operation. After surgery, each mouse was immediately resuscitated by subcutaneous injection of 1 mL warm saline.","[{'entity1': 'procedures', 'relationship': 'used', 'entity2': 'SHAM group'}, {'entity1': 'mice', 'relationship': 'administered', 'entity2': 'Eupatilin'}, {'entity1': 'mouse', 'relationship': 'resuscitated', 'entity2': 'saline'}]","<s>[INST] Extract the entities and relationships from the following text: </s>[SYS] User prompt [/INST] Similar procedures without ligation and puncture were used in the SHAM group. For the CLP+Eup group, the mice were administered Eupatilin (10mg/kg) by gavage 2 hours before operation. After surgery, each mouse was immediately resuscitated by subcutaneous injection of 1 mL warm saline. </s> Model answer <s>[{'entity1': 'procedures', 'relationship': 'used', 'entity2': 'SHAM group'}, {'entity1': 'mice', 'relationship': 'administered', 'entity2': 'Eupatilin'}, {'entity1': 'mouse', 'relationship': 'resuscitated', 'entity2': 'saline'}]</s>"
23,"The experimental samples were collected 24 hours after surgery. Besides, survival analysis was performed and lasted for 72 hours, with 10 mice per group, during which the mice were monitored every 6 hours and euthanized at the point of moribundity.","[{'entity1': 'samples', 'relationship': 'collected', 'entity2': 'surgery'}, {'entity1': 'survival analysis', 'relationship': 'performed', 'entity2': '72 hours'}, {'entity1': 'mice', 'relationship': 'monitored', 'entity2': 'hours'}, {'entity1': 'mice', 'relationship': 'euthanized', 'entity2': 'moribundity'}]","<s>[INST] Extract the entities and relationships from the following text: </s>[SYS] User prompt [/INST] The experimental samples were collected 24 hours after surgery. Besides, survival analysis was performed and lasted for 72 hours, with 10 mice per group, during which the mice were monitored every 6 hours and euthanized at the point of moribundity. </s> Model answer <s>[{'entity1': 'samples', 'relationship': 'collected', 'entity2': 'surgery'}, {'entity1': 'survival analysis', 'relationship': 'performed', 'entity2': '72 hours'}, {'entity1': 'mice', 'relationship': 'monitored', 'entity2': 'hours'}, {'entity1': 'mice', 'relationship': 'euthanized', 'entity2': 'moribundity'}]</s>"
24,"The lung tissue from three groups of mice were collected, fixed in 4% paraformaldehyde, dehydrated, embedded, and sliced into 4-μm-thick sections. Following the manufacturer’s instructions, the slices were stained by H&E staining kit.","[{'entity1': 'lung tissue', 'relationship': 'collected', 'entity2': 'groups'}, {'entity1': 'tissue', 'relationship': 'fixed in', 'entity2': 'paraformaldehyde'}, {'entity1': 'slices', 'relationship': 'stained by', 'entity2': 'H&E staining kit'}]","<s>[INST] Extract the entities and relationships from the following text: </s>[SYS] User prompt [/INST] The lung tissue from three groups of mice were collected, fixed in 4% paraformaldehyde, dehydrated, embedded, and sliced into 4-μm-thick sections. Following the manufacturer’s instructions, the slices were stained by H&E staining kit. </s> Model answer <s>[{'entity1': 'lung tissue', 'relationship': 'collected', 'entity2': 'groups'}, {'entity1': 'tissue', 'relationship': 'fixed in', 'entity2': 'paraformaldehyde'}, {'entity1': 'slices', 'relationship': 'stained by', 'entity2': 'H&E staining kit'}]</s>"
25,"The severity of lung injury was evaluated based on inflammatory cell infiltration, edema and congestion. The pulmonary injury was scored as follows: 0 point for no injury, 1 point for <25% of the field injured, 2 points for 25% to 50% of the field injured, 3 points for 50% to 75% of the field injured, and 4 points for >75% of the field injured.","[{'entity1': 'severity', 'relationship': 'evaluated based on', 'entity2': 'inflammatory cell infiltration'}, {'entity1': 'pulmonary injury', 'relationship': 'scored as', 'entity2': 'points'}]","<s>[INST] Extract the entities and relationships from the following text: </s>[SYS] User prompt [/INST] The severity of lung injury was evaluated based on inflammatory cell infiltration, edema and congestion. The pulmonary injury was scored as follows: 0 point for no injury, 1 point for <25% of the field injured, 2 points for 25% to 50% of the field injured, 3 points for 50% to 75% of the field injured, and 4 points for >75% of the field injured. </s> Model answer <s>[{'entity1': 'severity', 'relationship': 'evaluated based on', 'entity2': 'inflammatory cell infiltration'}, {'entity1': 'pulmonary injury', 'relationship': 'scored as', 'entity2': 'points'}]</s>"
26,"Immunohistochemical Assay The lung slices were dewaxed and rehydrated. Then, the antigen in slices was retrieved in citrate buffer (0.01 M, pH 6.0) for 10 minutes using a microwave oven, followed by quenching of endogenous peroxidase for 15 minutes.","[{'entity1': 'lung slices', 'relationship': 'retrieved in', 'entity2': 'citrate buffer'}, {'entity1': 'slices', 'relationship': 'quenched', 'entity2': 'peroxidase'}]","<s>[INST] Extract the entities and relationships from the following text: </s>[SYS] User prompt [/INST] Immunohistochemical Assay The lung slices were dewaxed and rehydrated. Then, the antigen in slices was retrieved in citrate buffer (0.01 M, pH 6.0) for 10 minutes using a microwave oven, followed by quenching of endogenous peroxidase for 15 minutes. </s> Model answer <s>[{'entity1': 'lung slices', 'relationship': 'retrieved in', 'entity2': 'citrate buffer'}, {'entity1': 'slices', 'relationship': 'quenched', 'entity2': 'peroxidase'}]</s>"
27,The slices were blocked with 5% BSA for an hour. The slices were then incubated with rabbit anti-fibrinogen antibody overnight at 4°C. The slices were stained using a DAB kit and observed under a microscope.,"[{'entity1': 'slices', 'relationship': 'blocked', 'entity2': 'BSA'}, {'entity1': 'slices', 'relationship': 'incubated with', 'entity2': 'rabbit anti-fibrinogen antibody'}, {'entity1': 'slices', 'relationship': 'stained using', 'entity2': 'DAB kit'}]","<s>[INST] Extract the entities and relationships from the following text: </s>[SYS] User prompt [/INST] The slices were blocked with 5% BSA for an hour. The slices were then incubated with rabbit anti-fibrinogen antibody overnight at 4°C. The slices were stained using a DAB kit and observed under a microscope. </s> Model answer <s>[{'entity1': 'slices', 'relationship': 'blocked', 'entity2': 'BSA'}, {'entity1': 'slices', 'relationship': 'incubated with', 'entity2': 'rabbit anti-fibrinogen antibody'}, {'entity1': 'slices', 'relationship': 'stained using', 'entity2': 'DAB kit'}]</s>"
28,"The experiment was performed according to the manufacturer’s instructions. The catalog numbers for the reagent kits were as follows: IL-1β (Catalog No:70-EK201B), IL-6 (Catalog No:70-EK206) and TNF-α (Catalog No:70-EK282) from MultiScience, China.","[{'entity1': 'experiment', 'relationship': 'performed according to', 'entity2': 'manufacturer’s instructions'}, {'entity1': 'reagent kits', 'relationship': 'included', 'entity2': 'IL-1β'}, {'entity1': 'reagent kits', 'relationship': 'included', 'entity2': 'IL-6'}, {'entity1': 'reagent kits', 'relationship': 'included', 'entity2': 'TNF-α'}, {'entity1': 'reagent kits', 'relationship': 'from', 'entity2': 'MultiScience, China'}]","<s>[INST] Extract the entities and relationships from the following text: </s>[SYS] User prompt [/INST] The experiment was performed according to the manufacturer’s instructions. The catalog numbers for the reagent kits were as follows: IL-1β (Catalog No:70-EK201B), IL-6 (Catalog No:70-EK206) and TNF-α (Catalog No:70-EK282) from MultiScience, China. </s> Model answer <s>[{'entity1': 'experiment', 'relationship': 'performed according to', 'entity2': 'manufacturer’s instructions'}, {'entity1': 'reagent kits', 'relationship': 'included', 'entity2': 'IL-1β'}, {'entity1': 'reagent kits', 'relationship': 'included', 'entity2': 'IL-6'}, {'entity1': 'reagent kits', 'relationship': 'included', 'entity2': 'TNF-α'}, {'entity1': 'reagent kits', 'relationship': 'from', 'entity2': 'MultiScience, China'}]</s>"
29,"After measuring the protein concentrations using the BCA kit, lysates containing 20 µg protein samples were separated on 10% or 12.5% SDS-PAGE gels. The proteins were electrotransferred onto PVDF membranes in a cold condition.","[{'entity1': 'protein concentrations', 'relationship': 'measured using', 'entity2': 'BCA kit'}, {'entity1': 'lysates', 'relationship': 'separated on', 'entity2': 'SDS-PAGE gels'}, {'entity1': 'proteins', 'relationship': 'electrotransferred onto', 'entity2': 'PVDF membranes'}]","<s>[INST] Extract the entities and relationships from the following text: </s>[SYS] User prompt [/INST] After measuring the protein concentrations using the BCA kit, lysates containing 20 µg protein samples were separated on 10% or 12.5% SDS-PAGE gels. The proteins were electrotransferred onto PVDF membranes in a cold condition. </s> Model answer <s>[{'entity1': 'protein concentrations', 'relationship': 'measured using', 'entity2': 'BCA kit'}, {'entity1': 'lysates', 'relationship': 'separated on', 'entity2': 'SDS-PAGE gels'}, {'entity1': 'proteins', 'relationship': 'electrotransferred onto', 'entity2': 'PVDF membranes'}]</s>"
30,"Plasminogen-activator inhibitor 1 (PAI-1) and key inflammation markers, ie, interleukin 6 (IL-6) and C-reactive protein (CRP), also play a role.","[{'entity1': 'Plasminogen-activator inhibitor 1', 'relationship': 'role', 'entity2': 'Inflammation'}, {'entity1': 'Interleukin 6', 'relationship': 'role', 'entity2': 'Inflammation'}, {'entity1': 'C-reactive protein', 'relationship': 'role', 'entity2': 'Inflammation'}]","<s>[INST] Extract the entities and relationships from the following text: </s>[SYS] User prompt [/INST] Plasminogen-activator inhibitor 1 (PAI-1) and key inflammation markers, ie, interleukin 6 (IL-6) and C-reactive protein (CRP), also play a role. </s> Model answer <s>[{'entity1': 'Plasminogen-activator inhibitor 1', 'relationship': 'role', 'entity2': 'Inflammation'}, {'entity1': 'Interleukin 6', 'relationship': 'role', 'entity2': 'Inflammation'}, {'entity1': 'C-reactive protein', 'relationship': 'role', 'entity2': 'Inflammation'}]</s>"
31,"Among proinflammatory cytokines contributing to IR development, the role of interleukin (IL)-6, which has autocrine and paracrine properties and is involved in insulin reception and free fatty acid (FFA) metabolism regulation, has been extensively studied.","[{'entity1': 'Interleukin 6', 'relationship': 'contributing', 'entity2': 'Insulin resistance'}, {'entity1': 'Interleukin 6', 'relationship': 'involved', 'entity2': 'insulin reception'}, {'entity1': 'Interleukin 6', 'relationship': 'involved', 'entity2': 'Dyslipidemia'}]","<s>[INST] Extract the entities and relationships from the following text: </s>[SYS] User prompt [/INST] Among proinflammatory cytokines contributing to IR development, the role of interleukin (IL)-6, which has autocrine and paracrine properties and is involved in insulin reception and free fatty acid (FFA) metabolism regulation, has been extensively studied. </s> Model answer <s>[{'entity1': 'Interleukin 6', 'relationship': 'contributing', 'entity2': 'Insulin resistance'}, {'entity1': 'Interleukin 6', 'relationship': 'involved', 'entity2': 'insulin reception'}, {'entity1': 'Interleukin 6', 'relationship': 'involved', 'entity2': 'Dyslipidemia'}]</s>"
32,"For cell immunofluorescence, macrophages were fixed with 4% paraformaldehyde for 10 min, permeabilized in 0.2% Triton X-100 for 15 minutes, and blocked in 5% BSA for 30 minutes.","[{'entity1': 'Macrophages', 'relationship': 'treatment', 'entity2': 'Paraformaldehyde'}, {'entity1': 'Macrophages', 'relationship': 'treatment', 'entity2': 'Triton X-100'}, {'entity1': 'Macrophages', 'relationship': 'treatment', 'entity2': 'BSA'}]","<s>[INST] Extract the entities and relationships from the following text: </s>[SYS] User prompt [/INST] For cell immunofluorescence, macrophages were fixed with 4% paraformaldehyde for 10 min, permeabilized in 0.2% Triton X-100 for 15 minutes, and blocked in 5% BSA for 30 minutes. </s> Model answer <s>[{'entity1': 'Macrophages', 'relationship': 'treatment', 'entity2': 'Paraformaldehyde'}, {'entity1': 'Macrophages', 'relationship': 'treatment', 'entity2': 'Triton X-100'}, {'entity1': 'Macrophages', 'relationship': 'treatment', 'entity2': 'BSA'}]</s>"
33,"For tissue immunofluorescence staining, lung sections were treated the same way as for immunohistochemistry, then incubated with the F4/80 and TF primary antibodies overnight at 4°C.","[{'entity1': 'Lung sections', 'relationship': 'treatment', 'entity2': 'Immunohistochemistry'}, {'entity1': 'Lung sections', 'relationship': 'incubated with', 'entity2': 'F4/80'}, {'entity1': 'Lung sections', 'relationship': 'incubated with', 'entity2': 'TF'}]","<s>[INST] Extract the entities and relationships from the following text: </s>[SYS] User prompt [/INST] For tissue immunofluorescence staining, lung sections were treated the same way as for immunohistochemistry, then incubated with the F4/80 and TF primary antibodies overnight at 4°C. </s> Model answer <s>[{'entity1': 'Lung sections', 'relationship': 'treatment', 'entity2': 'Immunohistochemistry'}, {'entity1': 'Lung sections', 'relationship': 'incubated with', 'entity2': 'F4/80'}, {'entity1': 'Lung sections', 'relationship': 'incubated with', 'entity2': 'TF'}]</s>"
34,"Eupatilin Decreased the Expression of Inflammatory Cytokines and TF in LPS-Induced RAW264.7 Cells To explore the effect of Eupatilin, we measured inflammatory cytokines and TF levels in RAW264.7 cells six hours after LPS stimulation.","[{'entity1': 'Eupatilin', 'relationship': 'Decreased', 'entity2': 'Expression of Inflammatory Cytokines'}, {'entity1': 'Eupatilin', 'relationship': 'Decreased', 'entity2': 'TF'}, {'entity1': 'Eupatilin', 'relationship': 'Effect on', 'entity2': 'RAW264.7 Cells'}, {'entity1': 'Inflammatory Cytokines', 'relationship': 'Measured in', 'entity2': 'RAW264.7 cells'}, {'entity1': 'TF', 'relationship': 'Measured in', 'entity2': 'RAW264.7 cells'}, {'entity1': 'LPS', 'relationship': 'Induced', 'entity2': 'RAW264.7 Cells'}]","<s>[INST] Extract the entities and relationships from the following text: </s>[SYS] User prompt [/INST] Eupatilin Decreased the Expression of Inflammatory Cytokines and TF in LPS-Induced RAW264.7 Cells To explore the effect of Eupatilin, we measured inflammatory cytokines and TF levels in RAW264.7 cells six hours after LPS stimulation. </s> Model answer <s>[{'entity1': 'Eupatilin', 'relationship': 'Decreased', 'entity2': 'Expression of Inflammatory Cytokines'}, {'entity1': 'Eupatilin', 'relationship': 'Decreased', 'entity2': 'TF'}, {'entity1': 'Eupatilin', 'relationship': 'Effect on', 'entity2': 'RAW264.7 Cells'}, {'entity1': 'Inflammatory Cytokines', 'relationship': 'Measured in', 'entity2': 'RAW264.7 cells'}, {'entity1': 'TF', 'relationship': 'Measured in', 'entity2': 'RAW264.7 cells'}, {'entity1': 'LPS', 'relationship': 'Induced', 'entity2': 'RAW264.7 Cells'}]</s>"
35,"Eupatilin Regulated LPS-Induced Inflammation and Coagulation by Suppressing JAK2/ STAT3 Signaling Pathway in RAW264.7 Cells To observe whether Eupatilin-mediated effects on inflammation and coagulation were linked to the JAK2/STAT3 signaling pathway, we performed Western blot in RAW264.7 cells to detect the phosphorylation of target proteins.","[{'entity1': 'Eupatilin', 'relationship': 'Regulated', 'entity2': 'Inflammation'}, {'entity1': 'Eupatilin', 'relationship': 'Regulated', 'entity2': 'Coagulation'}, {'entity1': 'Eupatilin', 'relationship': 'Linked to', 'entity2': 'JAK2/STAT3 signaling pathway'}, {'entity1': 'Eupatilin', 'relationship': 'Effects on', 'entity2': 'RAW264.7 Cells'}, {'entity1': 'Inflammation', 'relationship': 'Regulated by', 'entity2': 'Eupatilin'}, {'entity1': 'Coagulation', 'relationship': 'Regulated by', 'entity2': 'Eupatilin'}, {'entity1': 'JAK2/STAT3 signaling pathway', 'relationship': 'Linked to', 'entity2': 'Eupatilin'}, {'entity1': 'JAK2/STAT3 signaling pathway', 'relationship': 'Linked to', 'entity2': 'Inflammation'}, {'entity1': 'JAK2/STAT3 signaling pathway', 'relationship': 'Linked to', 'entity2': 'Coagulation'}, {'entity1': 'Inflammation', 'relationship': 'Linked to', 'entity2': 'JAK2/STAT3 signaling pathway'}, {'entity1': 'Coagulation', 'relationship': 'Linked to', 'entity2': 'JAK2/STAT3 signaling pathway'}]","<s>[INST] Extract the entities and relationships from the following text: </s>[SYS] User prompt [/INST] Eupatilin Regulated LPS-Induced Inflammation and Coagulation by Suppressing JAK2/ STAT3 Signaling Pathway in RAW264.7 Cells To observe whether Eupatilin-mediated effects on inflammation and coagulation were linked to the JAK2/STAT3 signaling pathway, we performed Western blot in RAW264.7 cells to detect the phosphorylation of target proteins. </s> Model answer <s>[{'entity1': 'Eupatilin', 'relationship': 'Regulated', 'entity2': 'Inflammation'}, {'entity1': 'Eupatilin', 'relationship': 'Regulated', 'entity2': 'Coagulation'}, {'entity1': 'Eupatilin', 'relationship': 'Linked to', 'entity2': 'JAK2/STAT3 signaling pathway'}, {'entity1': 'Eupatilin', 'relationship': 'Effects on', 'entity2': 'RAW264.7 Cells'}, {'entity1': 'Inflammation', 'relationship': 'Regulated by', 'entity2': 'Eupatilin'}, {'entity1': 'Coagulation', 'relationship': 'Regulated by', 'entity2': 'Eupatilin'}, {'entity1': 'JAK2/STAT3 signaling pathway', 'relationship': 'Linked to', 'entity2': 'Eupatilin'}, {'entity1': 'JAK2/STAT3 signaling pathway', 'relationship': 'Linked to', 'entity2': 'Inflammation'}, {'entity1': 'JAK2/STAT3 signaling pathway', 'relationship': 'Linked to', 'entity2': 'Coagulation'}, {'entity1': 'Inflammation', 'relationship': 'Linked to', 'entity2': 'JAK2/STAT3 signaling pathway'}, {'entity1': 'Coagulation', 'relationship': 'Linked to', 'entity2': 'JAK2/STAT3 signaling pathway'}]</s>"
